?label	?definition	?exactSynonym	?broadSynonym	?narrowSynonym	?relatedSynonym	?subsetType	?uri
"polling station"	"A human construction which is that part of a polling place where voters cast their ballot"	"polling station room"					"http://purl.obolibrary.org/obo/ENVO_03501202"
"polluted lake"	"A lake which has concentrations of environmental contaminants high enough to harm the ecosystems associated with it."					"http://purl.obolibrary.org/obo/envo#environmental_hazards"	"http://purl.obolibrary.org/obo/ENVO_01000680"
"polluted river"	"A river which has elevated levels of contaminants."						"http://purl.obolibrary.org/obo/ENVO_03600015"
"pollution control"	"A planned process during which the amount of pollutants released into an environmental system is regulated."			"pollution prevention"			"http://purl.obolibrary.org/obo/ENVO_02500042"
"pollution degradation"							"http://purl.obolibrary.org/obo/ENVO_02000177"
"pollution monitoring"	"A monitoring process that assays the level of environmental pollutants to determine the presence of effect of environmental pollution."					"http://purl.obolibrary.org/obo/envo#envoPolar"	"http://purl.obolibrary.org/obo/ENVO_02500043"
"poly-beta-hydroxybutyrate enriched soil"	"A portion of poly-beta-hydroxybutyrate enriched soil is a portion of soil with elevated levels of poly-beta-hydroxybutyrate."						"http://purl.obolibrary.org/obo/ENVO_00003093"
"polygenetic volcanic field"	"A volcanic field of scattered volcanic vents. These volcanic fields, containing numerous polygenetic volcanoes, are noted for having more than one eruptive event from the same vent(s), rather than the more common monogenetic volcanic field. Polygenetic volcanic fields generally occur where there is a high-level magma chamber. These volcanic fields may show lithological discontinuities due to major changes in magma chemistry, volcanotectonic events, or long erosional intervals, and may last >10 million year period."						"http://purl.obolibrary.org/obo/ENVO_00000462"
"polygonal karst"	"Karst completely pitted by closed depressions so that divides between them form a crudely polygonal network."						"http://purl.obolibrary.org/obo/ENVO_00000335"
"polymetallic nodule"	"Polymetallic nodules, also called manganese nodules, are rock concretions on the sea bottom formed of concentric layers of iron and manganese hydroxides around a core. Nodules vary in size from tiny particles visible only under a microscope to large pellets more than 20 centimetres (8 in) across. However, most nodules are between 5 and 10 cm in diameter."	"manganese nodule"					"http://purl.obolibrary.org/obo/ENVO_01000112"
"polymetallic nodule ecosystem"	"An ecosystem which is determined by the presence of rounded mineral concretions primarily composed of manganese hydroxides on the seafloor."	"manganese nodule ecosystem"			"polymetallic nodule field"		"http://purl.obolibrary.org/obo/ENVO_01001629"
"polymictic lake"	"A polymictic lake is a holomictic lake which is too shallow to allow thermal stratification and which can mix from top to bottom through the ice-free period of the year."						"http://purl.obolibrary.org/obo/ENVO_01000287"
"polynya"	"A sea surface layer which is 1) not covered by ice and 2) laterally surrounded by either pack ice or land and pack ice."	"POLYNA|Polynya|polynia|Polyn'ya"			"regional clearing|glade|big clearing|clearing|ice clearing"	"http://purl.obolibrary.org/obo/envo#envoCryo|http://purl.obolibrary.org/obo/envo#envoPolar"	"http://purl.obolibrary.org/obo/ENVO_00000484"
"polytunnel"	"An industrial building made from steel and covered in polyethylene used for plant cultivation."	"hoophouse|hoop greenhouse|polyhouse|high tunnel|grow tunnel"					"http://purl.obolibrary.org/obo/ENVO_03501102"
"pond"	"A body of water, usually of smaller size than a lake."	"Pond"	"lake"	"pool (water body)"	"ponds|pool (water body)|pond|POOL|millpond|pool"	"http://purl.obolibrary.org/obo/ENVO_03605025|http://purl.obolibrary.org/obo/ENVO_03605018|http://purl.obolibrary.org/obo/ENVO_03605023"	"http://purl.obolibrary.org/obo/ENVO_00000033"
"pond bed"	"The ground surface that lies beneath a pond."	"pond bottom"					"http://purl.obolibrary.org/obo/ENVO_00000512"
"pond soil"	"Soil which is adjacent to a pond."					"http://purl.obolibrary.org/obo/ENVO_03605015"	"http://purl.obolibrary.org/obo/ENVO_00005764"
"pond water"						"http://purl.obolibrary.org/obo/ENVO_03605019"	"http://purl.obolibrary.org/obo/ENVO_00002228"
"populated place"	"Place or area with clustered or scattered buildings and a permanent human population."	"settlement|populated places"	"place"		"populated locality|inhabited region"		"http://purl.obolibrary.org/obo/ENVO_00000062"
"porosity of snow"	"The porosity of some snow."	"snow porosity"					"http://purl.obolibrary.org/obo/ENVO_09200034"
"porosity of soil"	"The porosity of some soil."	"soil porosity"					"http://purl.obolibrary.org/obo/ENVO_09200004"
"porosity of water ice"	"The porosity of some water ice."	"water ice porosity"					"http://purl.obolibrary.org/obo/ENVO_09200035"
"post-anesthesia care unit facility"	"A hospital unit facility which is used to provide care for patients recovering from anesthesia."	"PACU|post-anesthesia recovery|post-anesthesia care ward|post-anesthesia unit|post-anesthesia ward|PAR"					"http://purl.obolibrary.org/obo/ENVO_03501173"
"potato silage"							"http://purl.obolibrary.org/obo/ENVO_00003978"
"potential energy"	"Energy possessed by an object because of its position relative to other objects, stresses within itself, its electric charge, or other factors."						"http://purl.obolibrary.org/obo/ENVO_2000016"
"poultry deep litter"							"http://purl.obolibrary.org/obo/ENVO_00003908"
"poultry hatchery"	"A hatchery in which the eggs of poultry are hatched under artificial conditions."						"http://purl.obolibrary.org/obo/ENVO_01001874"
"poultry litter"							"http://purl.obolibrary.org/obo/ENVO_00002192"
"poultry manure"	"Manure which is composed primarily of the feces of poultry."						"http://purl.obolibrary.org/obo/ENVO_01001117"
"pour-flush pit latrine"	"A pit latrine which includes a water seal (U-trap or siphon) used over one or two offset pits instead of a plain hole or seat. Water is manually poured through the trap to flush excreta into the latrine pit."		"toilet"		"head|dunny|bog"		"http://purl.obolibrary.org/obo/ENVO_01000535"
"pour-flush toilet fixture"	"A flush toilet fixture into which water is manually poured to dispose of excreta."	"pour flush toilet fixture"	"toilet|flush toilet"		"lavatory|john|head|comfort room|dunny|pot|bog|water closet|the heads|loo"		"http://purl.obolibrary.org/obo/ENVO_01000534"
"powdery snow"	"Uncompacted snow containing trapped atmospheric gases."					"http://purl.obolibrary.org/obo/envo#envoPolar|http://purl.obolibrary.org/obo/ENVO_03605019"	"http://purl.obolibrary.org/obo/ENVO_03000027"
"powdery snow avalanche"	"An avalanche during which powdery snow rapidly flows down a sloping surface."	"powder snow avalanche"				"http://purl.obolibrary.org/obo/envo#envoPolar|http://purl.obolibrary.org/obo/envo#environmental_hazards"	"http://purl.obolibrary.org/obo/ENVO_03000106"
"power plant"	"A power plant is a building which contains one or more generators which convert mechanical energy into electrical energy through the relative motion between a magnetic field and a conductor. The energy source harnessed to turn the generator varies widely."	"powerhouse|power station|generating plant|generating station"					"http://purl.obolibrary.org/obo/ENVO_00002214"
"prairie"	"An area of land of low topographic relief that historically supported grasses and herbs, with few trees, and having generally a mesic (moderate or temperate) climate. Dominated by tall grasses (contrast steppe)."				"grassland|llanos|veld|plain|pampa"	"http://purl.obolibrary.org/obo/ENVO_03605014|http://purl.obolibrary.org/obo/ENVO_03605023"	"http://purl.obolibrary.org/obo/ENVO_00000260"
"precipitation of sleet"	"A hydrological precipitation process during which water falls in both liquid and frozen form."	"sleet fall"	"sleet"			"http://purl.obolibrary.org/obo/envo#envoPolar|http://purl.obolibrary.org/obo/envo#envoCryo"	"http://purl.obolibrary.org/obo/ENVO_03400014"
"precipitation process"	"A precipitation process is a process in which a portion of some substance segregates from a material in which that substance or its precursors were dissolved or suspended in and settles due to a force such as gravity or centrifugal force."						"http://purl.obolibrary.org/obo/ENVO_01000875"
"preprocessing plant"	"A factory where raw or preprocessed materials are transformed into finished parts or products."	"preprocessing factory"					"http://purl.obolibrary.org/obo/ENVO_03501294"
"pressure lamp"	"A pressure lamp is a portable paraffin or oil lamp in which fuel is forced up into the mantle or burner by air pressure in the reservoir, which can be increased by pumping with a plunger."						"http://purl.obolibrary.org/obo/ENVO_01000597"
"pressure of air"	"The pressure of some air."	"air pressure"					"http://purl.obolibrary.org/obo/ENVO_09200011"
"pressure of atmospheric water vapour"	"The pressure of some atmospheric water vapour."	"atmospheric water vapour pressure"					"http://purl.obolibrary.org/obo/ENVO_09200033"
"pressure of water"	"The pressure of some water."	"water pressure"					"http://purl.obolibrary.org/obo/ENVO_3100033"
"primary aerosol formation process"	"A material transport process during which solid or liquid particles are directly introduced into a volume of gas."				"primary aerosol formation"		"http://purl.obolibrary.org/obo/ENVO_01001367"
"primary atmosphere"	"A planetary atmosphere which is formed as a result of the accretion of gaseous matter from the accretion disc of the planet's star."						"http://purl.obolibrary.org/obo/ENVO_01000959"
"primary cave"	"A cave formed at the same time as the surrounding rock."						"http://purl.obolibrary.org/obo/ENVO_01000361"
"primary forest"	"Forest which originally covered a region before changes in the environment brought about by people. (Source: PHC)"						"http://purl.obolibrary.org/obo/ENVO_01000768"
"primary microplastic particle"	"A microplastic particle which is the direct output of a manufacturing process."	"microplástico primario|Primäres Mikroplastik|microplastica primaria"			"microplastic"	"http://purl.obolibrary.org/obo/envo#envoPlastics"	"http://purl.obolibrary.org/obo/ENVO_01000945"
"primer (paint)"	"A paint product which adheres to surfaces and forms a binding layer, preparing it to receive paint."						"http://purl.obolibrary.org/obo/ENVO_03510029"
"prison"	"A human construction which is used to forcibly confine humans."				"remand center|detention center|lock-up|gaol|correctional center correctional centre|remand centre|correctional facility|penitentiary|jail"		"http://purl.obolibrary.org/obo/ENVO_03501204"
"private prison"	"A prison facility which is owned and operated by a private corporation."	"private remand center|private detention center|for-profit lock-up|for-profit penitentiary|private correctional facility|for-profit remand center|for-profit remand centre|private correctional centre|for-profit prison|for-profit detention centre|for-profit correctional centre|private jail|private correctional center|private penitentiary|for-profit correctional facility|for-profit correctional center|private remand centre|private lock-up|for-profit detention center|for-profit jail"					"http://purl.obolibrary.org/obo/ENVO_03501205"
"private swimming pool"	"A constructed swimming pool which is owned by a non-governmental legal entity or a collective of such entities."		"swimming pool|pool"				"http://purl.obolibrary.org/obo/ENVO_01000966"
"processed tobacco"	"A manufactured product which is produced by curing, subsequent aging, slow oxidation and degradation of carotenoids in tobacco leaves."						"http://purl.obolibrary.org/obo/ENVO_03600046"
"processing line"	"A system which consists of manufacturing equipment that performs manufacturing processes in a linear fashion."	"production line"					"http://purl.obolibrary.org/obo/ENVO_03501358"
"processing plant"	"A factory where raw materials are treated or prepared for final processing."	"processing factory"					"http://purl.obolibrary.org/obo/ENVO_03501295"
"proglacial"	"A positional quality which inheres in a bearer by virtue of the bearer in being in physical contact with, or close to, a glacial margin."						"http://purl.obolibrary.org/obo/ENVO_01001879"
"proglacial lake"	"A lake formed either by the damming action of a moraine or ice dam during the retreat of a melting glacier, or one formed by meltwater trapped against an ice mass due to isostatic depression of the crust around the ice."		"lake"			"http://purl.obolibrary.org/obo/envo#envoPolar"	"http://purl.obolibrary.org/obo/ENVO_00000435"
"proplyd"	"A protoplanetary disk which is externally illuminated and undergoing photoevaporation."	"ionized protoplanetary disk"				"http://purl.obolibrary.org/obo/envo#envoAstro"	"http://purl.obolibrary.org/obo/ENVO_01001151"
"protected area"	"An environmental zone which 1) contains ecosystems, constructed features, or other entities deemed to be of natural, historical, cultural, or other significance and 2) has been afforded legal protections restricting one or more forms of use by a competent authority."				"reserve|preserve"		"http://purl.obolibrary.org/obo/ENVO_01001567"
"protoplanet"	"An astronomical object that forms within a protoplanetary disc when planetesimals and other solid debris aggregate and, due to gravitational forces,  fuse and initiate internal melting to produce a differentiated interior."	"planetary embryo"				"http://purl.obolibrary.org/obo/envo#envoAstro"	"http://purl.obolibrary.org/obo/ENVO_01001149"
"protoplanetary disk"	"An astronomical object which is composed of dense gas and dust rotating around a young newly formed star, a T Tauri star, or a Herbig Ae/Be star in a disk-shaped configuration."					"http://purl.obolibrary.org/obo/envo#envoAstro"	"http://purl.obolibrary.org/obo/ENVO_01001150"
"pseudocrater"	"A volcanic landform which resembles a true volcanic crater, but differs in that it is not an actual vent from which lava has erupted. A pseudocrater is characterised by the absence of any magma conduit which connects below the surface of the earth. Pseudocraters are formed by steam explosions as flowing hot lava crosses over a wet surface, such as a swamp, a lake, or a pond. The explosive gases break through the lava surface in a manner similar to a phreatic eruption, and the tephra builds up crater-like forms which can appear very similar to real volcanic craters."	"rootless vent"					"http://purl.obolibrary.org/obo/ENVO_00000461"
"psychiatric intensive care unit facility"	"A hospital unit facility which is used to provide  intensive psychiatric care."	"psychiatric intensive care ward|PsICU|PICU"					"http://purl.obolibrary.org/obo/ENVO_03501176"
"psychiatric unit facility"	"A hospital unit facility which is used to provide psychiatric medicine."	"psychiatric ward|psych ward|psych unit"					"http://purl.obolibrary.org/obo/ENVO_03501175"
"public building"	"A building which is publically accessible."						"http://purl.obolibrary.org/obo/ENVO_01000781"
"public bus"	"A bus which is part of public infrastructure."	"public omnibus|public autobus|public motorbus|public multibus"					"http://purl.obolibrary.org/obo/ENVO_03501112"
"public ferry"	"A ferry which is owned by a government or other form of public representation."						"http://purl.obolibrary.org/obo/ENVO_03501113"
"public infrastructure"	"The system of public works in a country, state or region, including roads, utility lines and public buildings."		"infrastructure"				"http://purl.obolibrary.org/obo/ENVO_01000779"
"public park"	"A park which is owned by a governmental or state entity and which is accessible by its citizenry (i.e. the public)."					"http://purl.obolibrary.org/obo/ENVO_03605023"	"http://purl.obolibrary.org/obo/ENVO_03500002"
"public prison"	"A prison facility which is owned and operated by a state."	"public correctional centre|public gaol|correctional facility|public jail|public correctional facility|public correctional center|public remand center|public detention centre|public penitentiary|public lock-up|public remand centre|public detention center"			"detention center|penitentiary|jail|gaol|remand center"		"http://purl.obolibrary.org/obo/ENVO_01001481"
"public road"	"A road which is publically accessible."						"http://purl.obolibrary.org/obo/ENVO_01000780"
"public sports field"	"A sports facility which has been constructed for sports that require large outdoor spaces and is owned by a governmental or state entity and which is accessible by its citizenry (i.e. the public)."						"http://purl.obolibrary.org/obo/ENVO_03500003"
"public subway train"	"A subway train which is owned by a government or other form of public representation."						"http://purl.obolibrary.org/obo/ENVO_03501115"
"public swimming pool"	"A constructed swimming pool which is owned by a governmental or state entity."		"swimming pool|pool"				"http://purl.obolibrary.org/obo/ENVO_01000967"
"public toilet"	"An indoor toilet that is available for public use."						"http://purl.obolibrary.org/obo/ENVO_03501265"
"public train"	"A train which is owned by a government or other form of public representation."						"http://purl.obolibrary.org/obo/ENVO_03501114"
"public transit system"	"A constructed transport system which is owned by a government or other form of public representation."	"public transportation|public transport"					"http://purl.obolibrary.org/obo/ENVO_03501111"
"public transport hub"	"A transport hub which is part of public infrastructure."	"public transport interchange"					"http://purl.obolibrary.org/obo/ENVO_03501118"
"public utility line"	"A utility line which services the public power grid."						"http://purl.obolibrary.org/obo/ENVO_01000783"
"public-private prison"	"A prison facility which is owned by the state and operated by a private corporation."						"http://purl.obolibrary.org/obo/ENVO_03501355"
"puddle of water"	"A puddle is a small accumulation of water, on a surface. It can form either by pooling in a depression on the surface, or by surface tension upon a flat surface."	"puddle"				"http://purl.obolibrary.org/obo/ENVO_03605018"	"http://purl.obolibrary.org/obo/ENVO_01000871"
"pulp-bleaching waste water"					"pulp and paper wastewater"	"http://purl.obolibrary.org/obo/ENVO_03605019"	"http://purl.obolibrary.org/obo/ENVO_00002193"
"pumice"	"Pumice is a volcanic rock that consists of highly vesicular rough textured volcanic glass, which may or may not contain crystals."						"http://purl.obolibrary.org/obo/ENVO_01000663"
"pump"	"A device that moves fluids (liquids or gases), or sometimes slurries, by mechanical action."						"http://purl.obolibrary.org/obo/ENVO_03501266"
"pus material"	"A bodily fluid material which is composed primarily of pus, a bodily fluid consisting of a whitish-yellow or yellow substance produced during inflammatory responses of the body that can be found in regions of pyogenic bacterial infections. Pus is produced from the dead and living cells which travel into the intercellular spaces around the affected cells."						"http://purl.obolibrary.org/obo/ENVO_02000038"
"pycnocline"	"A cline across which the density of a fluid changes rapidly."				"stable density gradient"		"http://purl.obolibrary.org/obo/ENVO_01000259"
"pyritic acid mine drainage"		"Acid mine drainage which has elevated levels of pyritic acid."					"http://purl.obolibrary.org/obo/ENVO_00002195"
"pyroclastic cone"	"A cone made of material ejected from a volcano. The material can range from finest particles. In comparison, cinder cones are more uniform. They are usually found in or on larger features, such as stratovolcanoes, shield volcanoes and can be found inside calderas, however they can also be an independent feature. They can range from a few metres in height and are usually formed by a single eruption."	"pyroclastic dome"					"http://purl.obolibrary.org/obo/ENVO_00000356"
"pyroclastic shield volcano"	"A shield volcano that is formed mostly of pyroclastic and highly explosive eruptions rather than relatively fluid basaltic lava issuing from vents or fissures on the surface of the volcano. They typically display low-angle flank slopes and have little or no central collapse, although a shallow sag in the shield is commonly observed. Lava is commonly extruded after the cessation of explosive activity commonly superposes the vent region."	"terrestrial ignimbrite shield|ignimbrite shield volcano"					"http://purl.obolibrary.org/obo/ENVO_00000372"
"pyrolysis"	"A thermolysis process in which organic material is decomposed in the absence of oxygen."						"http://purl.obolibrary.org/obo/ENVO_01000841"
"quality of a foam"	"A physical quality which inheres in a liquid or solid bearer by virtue of that bearer trapping a gas in a colloidal suspension throughout its volume."					"http://purl.obolibrary.org/obo/envo#envoPlastics"	"http://purl.obolibrary.org/obo/ENVO_06105019"
"quarry"	"An open-pit mine from which rock or minerals are extracted."					"http://purl.obolibrary.org/obo/ENVO_03605014"	"http://purl.obolibrary.org/obo/ENVO_00000284"
"quarrying"	"A mining process during which rock or mineral deposits are extracted from the terrestrial surface layers of an astronomical body."						"http://purl.obolibrary.org/obo/ENVO_01001438"
"quartz glass"	"Quartz glass is a glass which is composed of silica in amorphous (non-crystalline) form."	"fused silica|fused quartz"					"http://purl.obolibrary.org/obo/ENVO_01000485"
"quasi-stationary front"	"A front which shows very little mobility."	"stationary front"					"http://purl.obolibrary.org/obo/ENVO_01001745"
"quicksand"	"Particulate environmental material which 1) is primarily composed of a fine, granular material such as sand, silt, or clay suspended in and saturated by water and 2) readily liquefies when weight is applied, losing strength and permitting objects to sink until their weight and buoyancy offset the weight of the displaced quicksand."						"http://purl.obolibrary.org/obo/ENVO_01001563"
"quicksand bed"	"A bed which is composed of quicksand forming a soft, shifting mass that yields easily to pressure."						"http://purl.obolibrary.org/obo/ENVO_00000285"
"quinate enriched soil"	"A portion of quinate enriched soil is a portion of soil with elevated levels of quinate."						"http://purl.obolibrary.org/obo/ENVO_00003095"
"raceway pond"	"A pond which humans have constructed for the cultivation of algae."		"algal pond"				"http://purl.obolibrary.org/obo/ENVO_03600047"
"radiant energy"	"Potential energy which is stored in the fields of propagated by electromagnetic radiation."						"http://purl.obolibrary.org/obo/ENVO_2000030"
"radiation"	"A process during which energy is emitted or transmitted in the form of waves or particles through space or a material medium."					"http://purl.obolibrary.org/obo/envo#envoAstro|http://purl.obolibrary.org/obo/envo#environmental_hazards"	"http://purl.obolibrary.org/obo/ENVO_01001023"
"radiation from a manufactured product"	"An electromagnetic radiation process during which electromagnetic waves or their quanta are emitted from a manufactured product."	"artificial radiation"	"anthropogenic radiation"			"http://purl.obolibrary.org/obo/envo#envoAstro|http://purl.obolibrary.org/obo/envo#environmental_hazards"	"http://purl.obolibrary.org/obo/ENVO_01001501"
"radiation shielding disposition"	"An environmental disposition which inheres in an entity that intercepts, attenuates, or blocks radiation."						"http://purl.obolibrary.org/obo/ENVO_01001195"
"radio device"	"A device capable of receiving and/or transmitting information encoded in electromagnetic radiation through wave modulation."		"radio"	"radio transmitter|radio receiver"			"http://purl.obolibrary.org/obo/ENVO_01000577"
"radio wave radiation"	"A radiation process during which electromagnetic waves or their quanta are emitted at wavelengths ranging from millimetre to kilometer scales."						"http://purl.obolibrary.org/obo/ENVO_21001213"
"radio wave stellar radiation"	"A stellar radiation process during which electromagnetic waves or their quanta are emitted from a star at wavelengths ranging from millimetre to kilometer scales."			"radio wave solar radiation"		"http://purl.obolibrary.org/obo/envo#envoAstro"	"http://purl.obolibrary.org/obo/ENVO_01001213"
"radioactive material"	"Any material containing unstable atoms that emit ionizing radiation as it decays."						"http://purl.obolibrary.org/obo/ENVO_03510037"
"radioactive sediment"						"http://purl.obolibrary.org/obo/ENVO_03605026"	"http://purl.obolibrary.org/obo/ENVO_00002154"
"radioactive spring"	"A mineral spring through which water with elevated levels of radioactive material flows."						"http://purl.obolibrary.org/obo/ENVO_01001896"
"radiotherapy unit facility"	"A hospital unit facility which is used to provide radiation therapy."	"radiotherapy ward|radiation therapy ward|radiation therapy unit"					"http://purl.obolibrary.org/obo/ENVO_03501177"
"railway"	"A permanent way having one or more rails which provides a track for cars."	"RAILWAY|railroad"	"railroad feature"				"http://purl.obolibrary.org/obo/ENVO_00000065"
"rain"	"An aggregate of raindrops falling to a planetary surface during a precipitation process."						"http://purl.obolibrary.org/obo/ENVO_01001564"
"rainbow"	"A rainbow is a photometeor which consists of a spectral separation of light, formed as a result of the reflection, refraction, and dispersion of light in water droplets suspended in an astronomical body's atmosphere."					"http://purl.obolibrary.org/obo/envo#envoAtmo"	"http://purl.obolibrary.org/obo/ENVO_01001006"
