?label	?subset	?definition	?URI
"dwarf gas planet"	"http://purl.obolibrary.org/obo/envo#envoAstro"	"A gas planet which 1) is considerably smaller than a gas giant and 2) has a rocky core around which a thick envelope primarily composed of hydrogen, helium, and smaller proportions of volatiles."	"http://purl.obolibrary.org/obo/ENVO_01001123"
"polar"	"http://purl.obolibrary.org/obo/envo#envoPolar"	"A polar condition is an environmental condition in which an environmental system receives low, yearly solar irradiance per unit area, resulting in colder climatic conditions."	"http://purl.obolibrary.org/obo/ENVO_01000238"
"freezing rainfall"	"http://purl.obolibrary.org/obo/envo#environmental_hazards"	"Water-based rainfall which freezes either 1) on impact with a surface to form a coating of clear ice (glaze) or 2) after percolating through surface layers."	"http://purl.obolibrary.org/obo/ENVO_01000896"
"meristematic cell"	"http://purl.obolibrary.org/obo/po#CL"	"A native plant cell (PO:0025606) synthesizing protoplasm and producing new cells by division and with only a primary cell wall."	"http://purl.obolibrary.org/obo/PO_0004010"
"astrogeological gas"	"http://purl.obolibrary.org/obo/envo#envoAstro"	"An astrogeological volatile which is composed primarily of chemical compounds with boiling points around those of hydrogen and helium."	"http://purl.obolibrary.org/obo/ENVO_01001155"
"seasonal snow patch"	"http://purl.obolibrary.org/obo/envo#envoPolar"	"A snow patch which forms during a cold season and melts away during the succeeding warm season."	"http://purl.obolibrary.org/obo/ENVO_03000114"
"snow water equivalent"	"http://purl.obolibrary.org/obo/envo#envoPolar"	"A depth which inheres in a layer of liquid water derived from the complete melting a mass of snow contained in an area."	"http://purl.obolibrary.org/obo/ENVO_03000142"
"plant cell"	"http://purl.obolibrary.org/obo/po#TraitNet"	"A cell which is a plant structure (PO:0009011)."	"http://purl.obolibrary.org/obo/PO_0009002"
"lunar rainbow"	"http://purl.obolibrary.org/obo/envo#envoAtmo"	"A lunar rainbow is a rainbow produced by the refraction of light, which has been reflected from a moon's surface, by water droplets in an astronomical body's atmosphere."	"http://purl.obolibrary.org/obo/ENVO_01001005"
"freezing fog"	"http://purl.obolibrary.org/obo/envo#envoCryo"	"A fog the droplets of which freeze upon contact with exposed objects, forming a coating of rime or glaze."	"http://purl.obolibrary.org/obo/ENVO_03000137"
"oceanic transient tracer"	"http://purl.obolibrary.org/obo/envo#envoEOVs"	"A transient tracer role which inheres in chemical entities in seawater."	"http://purl.obolibrary.org/obo/ENVO_01001878"
"nautical squall"	"http://purl.obolibrary.org/obo/envo#envoAtmo"	"A storm which is nautical, localised, and of high severity local storm considered as a whole: that is, winds and cloud mass and (if any) precipitation, thunder and lightning."	"http://purl.obolibrary.org/obo/ENVO_01001729"
"aerobic respiration, using ferrous ions as electron donor"	"envoPolar"		"http://purl.obolibrary.org/obo/GO_0019411"
"shoot axis"	"http://purl.obolibrary.org/obo/po#Angiosperm"	"A plant axis (PO:0025004) that is part of a shoot system (PO:0009006)."	"http://purl.obolibrary.org/obo/PO_0025029"
"anthropogenic litter"	"http://purl.obolibrary.org/obo/envo#envoPlastics"	"A material entity which has been discarded outside waste management systems by humans or their technologies."	"http://purl.obolibrary.org/obo/ENVO_03500005"
"coastal anthropogenic litter"	"http://purl.obolibrary.org/obo/envo#envoPlastics"	"Anthropogenic litter which is present in a coastal environment."	"http://purl.obolibrary.org/obo/ENVO_06105124"
"star"	"http://purl.obolibrary.org/obo/envo#envoPolar"	"An astronomical object which is composed primarily of luminous plasma held in a spherical form by gravitational forces."	"http://purl.obolibrary.org/obo/ENVO_01000801"
"environment determined by a biofilm on a plant surface"	"http://purl.obolibrary.org/obo/envo#envoMeo"	"An environmental system which has its properties and dynamics determined by a biofilm on the surface of a plant."	"http://purl.obolibrary.org/obo/ENVO_01001032"
"blizzard"	"http://purl.obolibrary.org/obo/envo#envoPolar"	"A blizzard is a severe snowstorm during which snowfall is transported by strong winds, sustained for several hours."	"http://purl.obolibrary.org/obo/ENVO_01000903"
"sleet pellet"	"http://purl.obolibrary.org/obo/envo#envoCryo"	"An ice mass which is primarily composed of frozen or mostly frozen raindrops or refrozen partially melted snowflakes."	"http://purl.obolibrary.org/obo/ENVO_03400015"
"saline aerosol environment"	"http://purl.obolibrary.org/obo/envo#envoOmics"	"An environmental system which has its properties and dynamics determined by a saline aerosol."	"http://purl.obolibrary.org/obo/ENVO_01001053"
"frost heave"	"http://purl.obolibrary.org/obo/envo#envoNceas"	"An elevation which is formed as an ice mass forms under soil, resulting in upwards deformation of the land surface."	"http://purl.obolibrary.org/obo/ENVO_01001568"
"manufactured plastisphere"	"http://purl.obolibrary.org/obo/envo#envoPlastics"	"A plastisphere which is composed primarily of manufactured plastic."	"http://purl.obolibrary.org/obo/ENVO_06105110"
"diurnal marine tidal flow process"	"http://purl.obolibrary.org/obo/envo#envoMarine"	"A tidal flow process which occurs once per day in ocean waters where a second daily oscillation is blocked by land masses or ocean basin geometry."	"http://purl.obolibrary.org/obo/ENVO_01001339"
"X-ray stellar radiation"	"http://purl.obolibrary.org/obo/envo#envoAstro"	"A stellar radiation process during which penetrating electromagnetic radiation is emitted by high-energy electrons as they fall into a lower state of energy."	"http://purl.obolibrary.org/obo/ENVO_01001217"
"cryosphere"	"http://purl.obolibrary.org/obo/envo#envoCryo"	"An astronomical body part which is composed primarily of environmental materials in their frozen form."	"http://purl.obolibrary.org/obo/ENVO_03000143"
"melt pond"	"http://purl.obolibrary.org/obo/envo#envoPolar"	"A water body which forms as a result of localised melting taking place on the surface of a glacier or a mass of sea ice and which is contained in the cavity formed by such melting."	"http://purl.obolibrary.org/obo/ENVO_03000040"
"polar front"	"http://purl.obolibrary.org/obo/envo#envoAtmo"	"A weather front which separates air masses of tropical and polar origin."	"http://purl.obolibrary.org/obo/ENVO_01001698"
"snow field"	"http://purl.obolibrary.org/obo/envo#envoPolar"	"A region of permanent snow in mountainous areas or high latitudes."	"http://purl.obolibrary.org/obo/ENVO_00000146"
"mudflow"	"http://purl.obolibrary.org/obo/envo#environmental_hazards"	"A mudflow is a form of mass wasting which involves very rapid to extremely rapid surging flow of debris that has become partially or fully liquified by the addition of significant amounts of water to clay-rich source material."	"http://purl.obolibrary.org/obo/ENVO_01000697"
"pelagic isopycnal surface"	"http://purl.obolibrary.org/obo/envo#envoPolar"	"A roughly planar, pelagic region characterised by equal water density."	"http://purl.obolibrary.org/obo/ENVO_01000083"
"microwave stellar radiation"	"http://purl.obolibrary.org/obo/envo#envoAstro"	"A stellar radiation process during which electromagnetic waves or their quanta are emitted from a star at wavelengths and frequencies which travel exclusively in a line-of-sight fashion and which may produce molecular rotation and torsion on contact with matter."	"http://purl.obolibrary.org/obo/ENVO_01001212"
"snow drift"	"http://purl.obolibrary.org/obo/envo#envoPolar"	"An accumulation of powdery snow which was transported and deposited via a snow drifting process."	"http://purl.obolibrary.org/obo/ENVO_03000112"
"meteor"	"http://purl.obolibrary.org/obo/envo#envoAtmo"	"A meteor is any matter- or energy-based entity which is located in the atmosphere of an astronomical body."	"http://purl.obolibrary.org/obo/ENVO_01001008"
"oceanic zone"	"http://purl.obolibrary.org/obo/envo#envoMarine"	"The water mass of an ocean that is not above a continental shelf."	"http://purl.obolibrary.org/obo/ENVO_00000207"
"ice fog"	"http://purl.obolibrary.org/obo/envo#envoCryo"	"Fog which is composed of particles of ice."	"http://purl.obolibrary.org/obo/ENVO_03000139"
"environment associated with a plant part or small plant"	"http://purl.obolibrary.org/obo/envo#envoMeo"	"An environmental system determined by part of a living or dead plant, or a whole small plant."	"http://purl.obolibrary.org/obo/ENVO_01001057"
"compaction process"	"http://purl.obolibrary.org/obo/envo#envoPolar"	"A physical process during which atoms, molecules, or other consituents of a material entity are forced closer together."	"http://purl.obolibrary.org/obo/ENVO_03000008"
"plant-associated environment"	"http://purl.obolibrary.org/obo/envo#envoOmics"	"An environmental system determined by a green plant."	"http://purl.obolibrary.org/obo/ENVO_01001001"
"photoevaporation"	"http://purl.obolibrary.org/obo/envo#envoAstro"	"A process during which energetic radiation ionises gas and causes it to disperse away from the ionising source."	"http://purl.obolibrary.org/obo/ENVO_01001146"
"environment associated with a fungal tissue"	"http://purl.obolibrary.org/obo/envo#envoMeo"	"An environmental system determined by part of a living or dead fungus."	"http://purl.obolibrary.org/obo/ENVO_01001058"
"oceanic mussel bed"	"http://purl.obolibrary.org/obo/envo#envoMarine"	"A mussel bed which is located in benthic regions beyond (offshore to) a continental shelf."	"http://purl.obolibrary.org/obo/ENVO_01001388"
"island"	"http://purl.obolibrary.org/obo/envo#envoPolar"	"Area of dry or relatively dry land surrounded by water or low wetland."	"http://purl.obolibrary.org/obo/ENVO_00000098"
"planktonic material"	"http://purl.obolibrary.org/obo/envo#envoPolar"	"A portion of planktonic material is a portion of environmental material primarily composed of plankton."	"http://purl.obolibrary.org/obo/ENVO_01000063"
"atmospheric aerosolised particle formation event"	"http://purl.obolibrary.org/obo/envo#envoAtmo"	"An aerosol formation event  which occurs in an atmosphere."	"http://purl.obolibrary.org/obo/ENVO_01001359"
"visible spectrum stellar radiation"	"http://purl.obolibrary.org/obo/envo#envoAstro"	"A stellar radiation process during which electromagnetic waves or their quanta are emitted from a star at wavelengths between 380 nm and 760 nm."	"http://purl.obolibrary.org/obo/ENVO_01001215"
"rubbish landslide"	"http://purl.obolibrary.org/obo/envo#environmental_hazards"	"A mass wasting process during which refuse from human activities, usually accumulated at a dumping site, falls down a slope under the force of gravity."	"http://purl.obolibrary.org/obo/ENVO_01000916"
"atmosphere-exposed melt pond"	"http://purl.obolibrary.org/obo/envo#envoPolar"	"A melt pond which has a surface exposed to the atmosphere."	"http://purl.obolibrary.org/obo/ENVO_03000050"
"planetary moon"	"http://purl.obolibrary.org/obo/envo#envoAstro"	"An astronomical body which orbits a planet of comparatively greater mass."	"http://purl.obolibrary.org/obo/ENVO_01000802"
"snow layer"	"http://purl.obolibrary.org/obo/envo#envoCryo"	"A cryospheric layer which is primarily composed of snow."	"http://purl.obolibrary.org/obo/ENVO_03000141"
"water-based cloud"	"http://purl.obolibrary.org/obo/envo#envoAtmo"	"A cloud which is primarily composed of water-based aerosols."	"http://purl.obolibrary.org/obo/ENVO_01001428"
"cyclonic circulation"	"http://purl.obolibrary.org/obo/envo#envoPolar"	"A mass fluid flow which moves  in the same direction as a planet's rotation, rotating due to a Coriolis effect."	"http://purl.obolibrary.org/obo/ENVO_01001748"
"photosphere"	"http://purl.obolibrary.org/obo/envo#envoAstro"	"An astronomical body part which is composed of those parts of a star, distal from the star's core, from which light is radiated into space."	"http://purl.obolibrary.org/obo/ENVO_01000821"
"frozen lead"	"http://purl.obolibrary.org/obo/envo#envoPolar"	"An ice lead within which new, nilas, and young ice has formed."	"http://purl.obolibrary.org/obo/ENVO_01001555"
"methane-laden permafrost"	"http://purl.obolibrary.org/obo/envo#envoPolar"	"Permafrost which contains pockets of trapped methane gas."	"http://purl.obolibrary.org/obo/ENVO_03000088"
"stellar radiation"	"http://purl.obolibrary.org/obo/envo#envoAstro"	"An electromagnetic radiation process during which electromagnetic waves or their quanta are emitted from a star."	"http://purl.obolibrary.org/obo/ENVO_01001211"
"snowpack"	"http://purl.obolibrary.org/obo/envo#envoPolar"	"A snow mass which is large enough, and persists long enough, to undergo compaction under its own weight, leading to layer-like structural differentiation."	"http://purl.obolibrary.org/obo/ENVO_03000116"
"soil pollution"	"http://purl.obolibrary.org/obo/envo#environmental_hazards"	"A pollution process during which contaminants are released into soil."	"http://purl.obolibrary.org/obo/ENVO_02500038"
"hydrological condensation process"	"http://purl.obolibrary.org/obo/envo#envoAtmo"	"Hydrological condensation is a process in which atmospheric water vapour undergoes a phase transition from the gas phase to the liquid phase."	"http://purl.obolibrary.org/obo/ENVO_01000624"
"cryoform"	"http://purl.obolibrary.org/obo/envo#envoPolar"	"A solid astronomical body part which is primarily composed of a continuous mass of snow and/or ice."	"http://purl.obolibrary.org/obo/ENVO_03000110"
"estuarine open water lower water column"	"http://purl.obolibrary.org/obo/envo#envoCmecs"	"A layer of estuarine water which extends from an estuarine pycnocline or mid-depth to the estuary bed and from a fiat boundary where the estuary bed below the water column reaches a depth of 4 meters to end of the estuary most distal from the coast."	"http://purl.obolibrary.org/obo/ENVO_01001322"
"ionizing stellar radiation"	"http://purl.obolibrary.org/obo/envo#envoAstro"	"A stellar radiation process during which electromagnetic waves or their quanta are emitted from a star with sufficient energy to disrupt molecular bonds or alter the electron number of atoms."	"http://purl.obolibrary.org/obo/ENVO_01001219"
"temperate marginal sea biome"	"http://purl.obolibrary.org/obo/envo#wwfBiome"	"A marginal sea biome which is located in a region with a temperate climate."	"http://purl.obolibrary.org/obo/ENVO_01000856"
"atmospheric subsidence"	"http://purl.obolibrary.org/obo/envo#envoAtmo"	"A material transport process during which a mass of air moves through an atmosphere towards a planetary surface."	"http://purl.obolibrary.org/obo/ENVO_01000729"
"non-saline environment"	"http://purl.obolibrary.org/obo/envo#envoEmpo"		"http://purl.obolibrary.org/obo/ENVO_01001003"
"ice cap climatic condition"	"http://purl.obolibrary.org/obo/envo#envoPolar"	"An ice cap climatic condition is a polar condition in which the montly average temperature does not exceed 0 degrees Celsius."	"http://purl.obolibrary.org/obo/ENVO_01000354"
"cirrocumulus cloud"	"http://purl.obolibrary.org/obo/envo#envoCloudAtlas"	"A cloud which 1) has been shaped into structural elements resembling grains or ripples, 2) is almost exclusively composed of ice crystals, 3) is located in the high level of the atmosphere (high étage)."	"http://purl.obolibrary.org/obo/ENVO_01001407"
"piece of plastic"	"envoPlastics"	"A mass of solid material which is primarily composed of plastic."	"http://purl.obolibrary.org/obo/ENVO_01000776"
"estuarine open water upper water column"	"http://purl.obolibrary.org/obo/envo#envoMarine"	"A layer of estuarine water which extends from the surface of the water column to the pycnocline or mid-depth and from a fiat boundary where the estuary bed below the water column reaches a depth of 4 meters until the end of the estuary most distal from the coast."	"http://purl.obolibrary.org/obo/ENVO_01001316"
"mini-Neptune"	"http://purl.obolibrary.org/obo/envo#envoAstro"	"A gas planet which has an atmosphere composed of hydrogen and helium  - probably with deep layers of ice, rock or liquid oceans (made of water, ammonia, a mixture of both, or heavier volatiles) - and a small core made of low-density volatiles."	"http://purl.obolibrary.org/obo/ENVO_01001128"
"hypersaline water environment"	"http://purl.obolibrary.org/obo/envo#envoPolar"	"An environmental system which has its properties and dynamics determined by hypersaline water."	"http://purl.obolibrary.org/obo/ENVO_01001043"
"geological carbon sequestration"	"http://purl.obolibrary.org/obo/envo#envoNceas"	"A carbon sequestration process during which carbon dioxide is stored in underground geological formations."	"http://purl.obolibrary.org/obo/ENVO_04000017"
"stratus cloud"	"http://purl.obolibrary.org/obo/envo#envoAtmo"	"A cloud which 1) occurs in the form of a layer with a fairly uniform base or, less frequently, ragged patches, 2) is composed of small water droplets, 3) is located in the low level of the atmosphere (low étage)."	"http://purl.obolibrary.org/obo/ENVO_01001413"
"obsolete organism-associated habitat"	"http://purl.obolibrary.org/obo/envo#EnvO-Lite-GSC"	"A habitat that is in or on a living thing."	"http://purl.obolibrary.org/obo/ENVO_00002032"
"astronomical body part"	"http://purl.obolibrary.org/obo/envo#envoAstro"	"A material part of an astronomical body."	"http://purl.obolibrary.org/obo/ENVO_01000813"
"stratocumulus cloud"	"http://purl.obolibrary.org/obo/envo#envoCloudAtlas"	"A cloud which 1) has been shaped into non-fibrous tessellations, rounded masses, or rolls, 2) is primarily composed of water droplets, and may contain raindrops or, more rarely, snow pellets, snow crystals and snowflakes, 3) is located in the low level of the atmosphere (low étage)."	"http://purl.obolibrary.org/obo/ENVO_01001412"
"alpine soil"	"http://purl.obolibrary.org/obo/envo#envoPolar"	"Soil which is part of an alpine environment."	"http://purl.obolibrary.org/obo/ENVO_00005741"
"desert area"	"http://purl.obolibrary.org/obo/envo#envoPolar"	"A region rendered barren or partially barren by environmental extremes, especially by low rainfall."	"http://purl.obolibrary.org/obo/ENVO_00000097"
"soot"	"http://purl.obolibrary.org/obo/envo#envoPolar"	"Particulate environmental material which is composed primarily of carbon particles formed through the incomplete combustion of hydrocarbons."	"http://purl.obolibrary.org/obo/ENVO_03000021"
"iceberg"	"http://purl.obolibrary.org/obo/envo#envoPolar"	"An ice mass which has broken away from a larger ice mass on land, such as a glacier or ice shelf, and may be either afloat or aground."	"http://purl.obolibrary.org/obo/ENVO_01001546"
"weathering"	"http://purl.obolibrary.org/obo/envo#envoPlastics"	"A material transformation process during which the properties of a material are changed as a result of in situ exposure to atmospheric processes."	"http://purl.obolibrary.org/obo/ENVO_06105119"
"temperate marine upwelling biome"	"http://purl.obolibrary.org/obo/envo#wwfBiome"	"A marine upwelling biome which is located in a region subject to temperate climate patterns."	"http://purl.obolibrary.org/obo/ENVO_01000860"
"coastal water body"	"http://purl.obolibrary.org/obo/envo#envoPolar"	"A lentic water body which is adjacent to a coast."	"http://purl.obolibrary.org/obo/ENVO_02000049"
"deep marine sediment"	"http://purl.obolibrary.org/obo/envo#envoPolar"	"Sediment that accumulates in the flat or very gently sloping areas of the deep ocean basin floor. The three main types of deep marine sediment, also known as pelagic sediment, are siliceous oozes, calcareous oozes, and red clays."	"http://purl.obolibrary.org/obo/ENVO_00002113"
"avalanche"	"http://purl.obolibrary.org/obo/envo#envoPolar"	"A mass wasting flow during which snow rapidly flows down a sloping surface."	"http://purl.obolibrary.org/obo/ENVO_01000691"
"landslide process"	"http://purl.obolibrary.org/obo/envo#environmental_hazards"	"A landslide is a process whereby a large mass of earth and rocks moves down a hill or a mountainside."	"http://purl.obolibrary.org/obo/ENVO_01000692"
"erosionally enriched ice"	"http://purl.obolibrary.org/obo/envo#envoPolar"	"Water ice which contains material liberated during an erosion process."	"http://purl.obolibrary.org/obo/ENVO_03000025"
"lava planet"	"http://purl.obolibrary.org/obo/envo#envoAstro"	"A planet which has a surface layer that nearly completely or completely covered by lava, and which has a substantial portion of its mass composed of lava."	"http://purl.obolibrary.org/obo/ENVO_01001143"
"intestine environment"	"http://purl.obolibrary.org/obo/envo#envoMeo"	"An environmental system determined by an intestine."	"http://purl.obolibrary.org/obo/ENVO_2100002"
"hadalpelagic zone"	"http://purl.obolibrary.org/obo/envo#envoMarine"	"The zone of an ocean in oceanic trenches, lying between 6000m and 10,000m."	"http://purl.obolibrary.org/obo/ENVO_00000214"
"super-Earth"	"http://purl.obolibrary.org/obo/envo#envoAstro"	"A terrestrial planet which has a mass higher than Earth's, but substantially below the masses of Uranus and Neptune (15 and 17 Earth masses, respectively)."	"http://purl.obolibrary.org/obo/ENVO_01001134"
"aerobic respiration, using nitrite as electron donor"	"envoPolar"		"http://purl.obolibrary.org/obo/GO_0019332"
"cirrus uncinus cloud"	"http://purl.obolibrary.org/obo/envo#envoAtmo"	"A cirrus cloud which does not have grey parts and which is often shaped like a comma, terminating at its highest point in a hook, or in a tuft, the upper part of which is not in the form of a rounded protuberance."	"http://purl.obolibrary.org/obo/ENVO_01001421"
"water ice crystal"	"http://purl.obolibrary.org/obo/envo#envoPolar"	"A crystal which is primarily composed of water ice."	"http://purl.obolibrary.org/obo/ENVO_01000846"
"skin environment"	"http://purl.obolibrary.org/obo/envo#envoMeo"	"An environment determined by an area or zone of skin tissue."	"http://purl.obolibrary.org/obo/ENVO_2100003"
"channel of an intermittent river"	"http://purl.obolibrary.org/obo/envo#envoCesab"	"A channel of an intermittent stream which contains a river when water supply exceeds evapotranspiration and bed seepage."	"http://purl.obolibrary.org/obo/ENVO_01000979"
"land fire"	"http://purl.obolibrary.org/obo/envo#environmental_hazards"	"A fire which occurs on land, typically consuming a terrestrial ecosystem as fuel."	"http://purl.obolibrary.org/obo/ENVO_01001292"
"hailstorm"	"http://purl.obolibrary.org/obo/envo#environmental_hazards"	"An atmospheric storm during which intense hailfall occurs"	"http://purl.obolibrary.org/obo/ENVO_01000880"
"dioxygen dissolved in marine water"	"http://purl.obolibrary.org/obo/envo#envoEOVs"	"Dioxygen which is the solute in a solution with ocean water as its solvent."	"http://purl.obolibrary.org/obo/ENVO_01001495"
"estuarine coastal pycnocline"	"http://purl.obolibrary.org/obo/envo#envoCmecs"	"A pycnocline which is part of an estuarine water body, spanning from the shore to a fiat boundary where the estuary bed below the water column reaches a depth of 4 meters."	"http://purl.obolibrary.org/obo/ENVO_01001313"
"plant epidermis"	"http://purl.obolibrary.org/obo/po#TraitNet"	"A portion of plant tissue (PO:0009007) composed of plant epidermal cells (PO:0004013) that develops from the protoderm (PO:0006210) and covers the surface of a plant structure (PO:0009011)."	"http://purl.obolibrary.org/obo/PO_0005679"
"anafront"	"http://purl.obolibrary.org/obo/envo#envoAtmo"	"A weather front at which warm air is ascending to high altitudes along the frontal surface."	"http://purl.obolibrary.org/obo/ENVO_01001708"
"primary microplastic particle"	"http://purl.obolibrary.org/obo/envo#envoPlastics"	"A microplastic particle which is the direct output of a manufacturing process."	"http://purl.obolibrary.org/obo/ENVO_01000945"
"shoot axis apex"	"http://purl.obolibrary.org/obo/po#reference"	"A shoot axis (PO:0025029) that is the most distal part of a shoot system (PO:0009006) and has as parts a shoot apical meristem (PO:0020148) and the youngest primordia (PO:0025127)."	"http://purl.obolibrary.org/obo/PO_0000037"
"carbon sequestration by the ocean carbonate system"	"http://purl.obolibrary.org/obo/envo#envoNceas"	"A carbon sequestration process during which carbon dioxide is stored in the carbonate system of an ocean."	"http://purl.obolibrary.org/obo/ENVO_04000018"
"aerosolised particle formation event"	"http://purl.obolibrary.org/obo/envo#envoAtmo"	"An aerosol formation process during which the rate of particle formation exceeds that which is normally present in the site of its occurrence."	"http://purl.obolibrary.org/obo/ENVO_01001372"
"geographic feature"	"http://purl.obolibrary.org/obo/envo#envoPolar"	"An astrononmical body part which delimited by physical discontinuities with its surroundings."	"http://purl.obolibrary.org/obo/ENVO_00000000"
"young ice formation process"	"http://purl.obolibrary.org/obo/envo#envoPolar"	"A sea ice formation process during which water freezes to the bottom of an existing nilas ice floe creating a thicker ice floe known as young ice."	"http://purl.obolibrary.org/obo/ENVO_03000059"
"clathrate material"	"http://purl.obolibrary.org/obo/envo#envoPolar"	"A material which is primarily composed of a substance arranged as a lattice which can trap or contain other molecules."	"http://purl.obolibrary.org/obo/ENVO_01000850"
"rime"	"http://purl.obolibrary.org/obo/envo#envoPolar"	"Water ice which 1) has a white or milky and opaque appearance, 2) has a granular texture, and 3) is formed as a result of the deposition and rapid freezing of supercooled water drops as they make contact with an exposed object."	"http://purl.obolibrary.org/obo/ENVO_01001848"
