?label	?subset	?definition	?URI
"area of barren land"	"http://purl.obolibrary.org/obo/envo#envoPolar"	"An area of a planet's surface which is primarily composed of bedrock, desert pavement, scarp rock, talus, material exposed by slides, volcanic material, glacial debris, sand, material exposed during strip mining, gravel, and other accumulations of earthen material in contact with an atmospheric column extending from the planetary boundary layer to the planet's exosphere with little to no physical obstruction."	"http://purl.obolibrary.org/obo/ENVO_01000752"
"first year ice"	"http://purl.obolibrary.org/obo/envo#envoPolar"	"Sea ice which has formed over a single freezing season."	"http://purl.obolibrary.org/obo/ENVO_03000071"
"freshwater algal bloom"	"http://purl.obolibrary.org/obo/envo#envoPolar"	"An algal bloom that is located in freshwater. Freshwater algal blooms are the result of an excess of nutrients, particularly some phosphates."	"http://purl.obolibrary.org/obo/ENVO_2000005"
"root"	"http://purl.obolibrary.org/obo/po#reference"	"A plant axis (PO:0025004) that lacks shoot axis nodes (PO:0005004) and usually grows indeterminately."	"http://purl.obolibrary.org/obo/PO_0009005"
"hot Jupiter"	"http://purl.obolibrary.org/obo/envo#envoAstro"	"A giant gas planet which has a jovian-scale mass (0.36–11.8 Jupiter masses), a short orbital period (1.3–111 Earth days), and which is close to the star it orbits, resulting in extreme and exotic atmospheric properties."	"http://purl.obolibrary.org/obo/ENVO_01001131"
"ecosystem-wide aerobic respiration"	"http://purl.obolibrary.org/obo/envo#envoPolar"	"A process which consists of all aerobic respiration processes instantiated in an ecosystem."	"http://purl.obolibrary.org/obo/ENVO_01000633"
"marine biota"	"http://purl.obolibrary.org/obo/envo#envoPlastics"	"A biota which inhabits a marine ecosystem."	"http://purl.obolibrary.org/obo/ENVO_06105013"
"lake-effect snow storm"	"http://purl.obolibrary.org/obo/envo#envoPolar"	"A snowstorm during which intense lake-effect snowfall occurs."	"http://purl.obolibrary.org/obo/ENVO_03400007"
"aeolian transport process"	"http://purl.obolibrary.org/obo/envo#envoPolar"	"A material transport process during which one or more environmental materials are transported by the action of wind."	"http://purl.obolibrary.org/obo/ENVO_03000020"
"solar rainbow"	"http://purl.obolibrary.org/obo/envo#envoAtmo"	"A solar rainbow is a rainbow produced by the refraction of light. which has been emitted by a star, by water droplets in the atmosphere of an astronomical body."	"http://purl.obolibrary.org/obo/ENVO_01001007"
"ice mass"	"http://purl.obolibrary.org/obo/envo#envoPolar"	"A mass of water ice."	"http://purl.obolibrary.org/obo/ENVO_01000293"
"cloud condensation nucleus"	"http://purl.obolibrary.org/obo/envo#envoPolar"	"A solid or liquid particle, usually 0.2 micrometers in diameter, on which water vapour condenses, seeding cloud formation."	"http://purl.obolibrary.org/obo/ENVO_01000912"
"neve"	"http://purl.obolibrary.org/obo/envo#envoPolar"	"Partially compacted granular snow, which has undergone several cycles of melting and refreezing while being compacted, usually found on the atmosphere-exposed surface of a glacier."	"http://purl.obolibrary.org/obo/ENVO_03000000"
"icestorm"	"http://purl.obolibrary.org/obo/envo#envoPolar"	"An atmospheric storm during which freezing rain falls and accumulates as ice on exposed surfaces."	"http://purl.obolibrary.org/obo/ENVO_01000882"
"wet snow avalanche"	"http://purl.obolibrary.org/obo/envo#envoPolar"	"An avalanche during which a suspension of water and snow flows down a sloping surface."	"http://purl.obolibrary.org/obo/ENVO_03000107"
"area of scrub"	"http://purl.obolibrary.org/obo/envo#nlcd2011"	"An area of a planet's surface which is primarily covered by a shrubs, young trees, or stunted trees.. The surfaces of this area are in contact with an atmospheric column extending from the planetary boundary layer to the planet's exosphere with little to no physical obstruction."	"http://purl.obolibrary.org/obo/ENVO_01000869"
"concentration of carbon dioxide in an atmosphere"	"http://purl.obolibrary.org/obo/envo#envoAtmo"	"The concentration of carbon dioxide when measured in air that is part of an atmosphere."	"http://purl.obolibrary.org/obo/ENVO_01001865"
"radiation"	"http://purl.obolibrary.org/obo/envo#envoAstro"	"A process during which energy is emitted or transmitted in the form of waves or particles through space or a material medium."	"http://purl.obolibrary.org/obo/ENVO_01001023"
"hydrocarbon gas"	"http://purl.obolibrary.org/obo/envo#envoPolar"	"A gas that is primarily composed of hydrocarbon molecules."	"http://purl.obolibrary.org/obo/ENVO_01000554"
"subpolar coniferous forest biome"	"http://purl.obolibrary.org/obo/envo#wwfBiome"	"A  coniferous forest biome which includes communities adapted to subpolar conditions."	"http://purl.obolibrary.org/obo/ENVO_01000250"
"saline sediment environment"	"http://purl.obolibrary.org/obo/envo#envoOmics"	"An environmental system which has its properties and dynamics determined by sediment permeated by saline water."	"http://purl.obolibrary.org/obo/ENVO_01001050"
"shoot axis"	"http://purl.obolibrary.org/obo/po#Rice"	"A plant axis (PO:0025004) that is part of a shoot system (PO:0009006)."	"http://purl.obolibrary.org/obo/PO_0025029"
"marine chemocline"	"http://purl.obolibrary.org/obo/envo#envoPolar"	"A marine chemocline is a marine cline caused by a strong, vertical chemistry gradient within a body of marine water. Chemoclines most commonly occur where local conditions favor the formations of anoxic bottom water."	"http://purl.obolibrary.org/obo/ENVO_01000076"
"sea state"	"http://purl.obolibrary.org/obo/envo#envoMarine"	"A physical quality which inheres in a marine water body by virtue of the height, wavelength, period, and directional energy flux of its waves which evolve into swell through nonlinear dynamics."	"http://purl.obolibrary.org/obo/ENVO_01001374"
"ice cap depression"	"http://purl.obolibrary.org/obo/envo#envoPolar"	"A depression which is part of an ice cap."	"http://purl.obolibrary.org/obo/ENVO_00000531"
"estuarine tidal riverine open water upper water column"	"http://purl.obolibrary.org/obo/envo#envoMarine"	"A layer of fresh, tidal estuarine water which extends from the surface of the water column to the pycnocline or mid-depth and from a fiat boundary where the estuary bed below the water column reaches a depth of 4 meters until the end of the estuary most distal from the coast."	"http://purl.obolibrary.org/obo/ENVO_01001327"
"environment determined by a biofilm on a saline surface"	"http://purl.obolibrary.org/obo/envo#envoEmpo"	"An environmental system which has its properties and dynamics determined by a biofilm on a surface which is exposed to saline materials."	"http://purl.obolibrary.org/obo/ENVO_01001056"
"slab avalanche"	"http://purl.obolibrary.org/obo/envo#envoPolar"	"A mass wasting process during which slab snow rapidly moves down a sloping surface."	"http://purl.obolibrary.org/obo/ENVO_03000105"
"ice piedmont"	"http://purl.obolibrary.org/obo/envo#envoPolar"	"A glacier covering a coastal strip of low-lying land backed by mountains, and sloping gently seaward over a distance up to 30km or more to terminate in ice cliffs or to merge with an ice shelf."	"http://purl.obolibrary.org/obo/ENVO_00009725"
"altocumulus cloud"	"http://purl.obolibrary.org/obo/envo#envoCloudAtlas"	"A cloud which 1) has been shaped into laminae, rounded masses or rolls, 2) is exclusively composed of water droplets, 3) is located in the middle level of the atmosphere (middle étage)."	"http://purl.obolibrary.org/obo/ENVO_01001409"
"hailstorm"	"http://purl.obolibrary.org/obo/envo#envoAtmo"	"An atmospheric storm during which intense hailfall occurs"	"http://purl.obolibrary.org/obo/ENVO_01000880"
"mangrove biome"	"http://purl.obolibrary.org/obo/envo#wwfBiome"	"A mangrove ecosystem which is in its climactic successional state."	"http://purl.obolibrary.org/obo/ENVO_01000181"
"temperate broadleaf forest biome"	"http://purl.obolibrary.org/obo/envo#wwfBiome"	"A broadleaf forest which is subject to temperate climate patterns."	"http://purl.obolibrary.org/obo/ENVO_01000202"
"interglacial"	"http://purl.obolibrary.org/obo/envo#envoPolar"	"An interval of time within an ice age and during which temperatures rise and result in planet-wide glacier retreat."	"http://purl.obolibrary.org/obo/ENVO_01001642"
"xeric shrubland biome"	"http://purl.obolibrary.org/obo/envo#wwfBiome"		"http://purl.obolibrary.org/obo/ENVO_01000218"
"environmental condition"	"http://purl.obolibrary.org/obo/envo#envoPolar"	"An environmental condition is a range of a determinate quality or combination of qualities that are present in an environmental system."	"http://purl.obolibrary.org/obo/ENVO_01000203"
"aeolian transport of snow"	"http://purl.obolibrary.org/obo/envo#envoPolar"	"An aeolian transport process during which powdery snow is displaced and moved."	"http://purl.obolibrary.org/obo/ENVO_03000103"
"marine photic zone"	"http://purl.obolibrary.org/obo/envo#envoPolar"	"The zone of an ocean from the surface to where photosynthesis can occur, due to the penetration of light."	"http://purl.obolibrary.org/obo/ENVO_00000209"
"marine anthropogenic litter"	"http://purl.obolibrary.org/obo/envo#envoPlastics"	"Anthropogenic litter which is present in the marine environment."	"http://purl.obolibrary.org/obo/ENVO_06105107"
"organic object formed through microbial activity"	"http://purl.obolibrary.org/obo/envo#envoPolar"	"An organic object which is formed as a result of the biological processes mediated by microbial assemblages."	"http://purl.obolibrary.org/obo/ENVO_01000007"
"tundra climatic condition"	"http://purl.obolibrary.org/obo/envo#envoPolar"	"An tundra climatic condition is a polar condition in which at least one month's average temperature exceeds 0 degrees Celsius."	"http://purl.obolibrary.org/obo/ENVO_01000370"
"marine pelagic zone"	"http://purl.obolibrary.org/obo/envo#envoMarine"	"An open ocean region."	"http://purl.obolibrary.org/obo/ENVO_00000208"
"flash flood"	"http://purl.obolibrary.org/obo/envo#environmental_hazards"	"A flash flood is a flood formed by the rapid flooding of geomorphic low-lying areas. It may be caused by heavy rain associated with a severe thunderstorm, hurricane, tropical storm, or meltwater from ice or snow flowing over ice sheets or snowfields. Flash floods may also occur after the collapse of a natural ice or debris dam, or a human structure such as a man-made dam. Flash floods are distinguished from a regular flood by a timescale of less than six hours."	"http://purl.obolibrary.org/obo/ENVO_01000713"
"area of developed space with low usage intensity"	"http://purl.obolibrary.org/obo/envo#nlcd2011"	"An area of a planet's surface which is primarily covered by cultivated or anthropically maintained vegetation and by constructed or manufactured objects and materials covering up to approximately half its extent. Such areas are used for low intensity purposes such as accommodating collections of single-family residential units. This area is in contact with an atmospheric column extending from the planetary boundary layer to the planet's exosphere with little to no physical obstruction."	"http://purl.obolibrary.org/obo/ENVO_01000884"
"liquid environmental material"	"http://purl.obolibrary.org/obo/envo#envoPolar"	"An environmental material which is in a liquid state."	"http://purl.obolibrary.org/obo/ENVO_01000815"
"biodegradation"	"http://purl.obolibrary.org/obo/envo#envoPlastics"	"A biological process during which a material entity is broken down."	"http://purl.obolibrary.org/obo/ENVO_06105014"
"water column exposed melt pond"	"http://purl.obolibrary.org/obo/envo#envoPolar"	"A melt pond which is formed close to that part of an ice mass which is in contact with some underlying water body, and which has channels connecting it to that water body."	"http://purl.obolibrary.org/obo/ENVO_03000119"
"drought"	"http://purl.obolibrary.org/obo/envo#environmental_hazards"	"A hydrological precipitation process with a reduced rate relative to some historical average, typically resulting in ecosystemic perturbations."	"http://purl.obolibrary.org/obo/ENVO_1000745"
"particulate organic nitrogen"	"http://purl.obolibrary.org/obo/envo#envoNceas"	"Particulate organic matter which is composed primarily of nitrogen."	"http://purl.obolibrary.org/obo/ENVO_04000014"
"neritic mussel reef"	"http://purl.obolibrary.org/obo/envo#envoCmecs"	"A marine reef which is located on a shelf (i.e. in the neritic zone) and primarily composed of self-adhered or conglomerated mussel shells."	"http://purl.obolibrary.org/obo/ENVO_01001380"
"marine mesopelagic zone"	"http://purl.obolibrary.org/obo/envo#envoMarine"	"The zone of an ocean immediately below the photic zone down to a depth where the water temperature is 10degC (the thermocline)."	"http://purl.obolibrary.org/obo/ENVO_00000213"
"particle radiation"	"http://purl.obolibrary.org/obo/envo#envoAstro"	"A radiation process during which energy is transmitted or emitted by means of fast-moving subatomic particles."	"http://purl.obolibrary.org/obo/ENVO_01001024"
"mixed forest biome"	"http://purl.obolibrary.org/obo/envo#wwfBiome"	"A mixed forest which is in its climactic successional state."	"http://purl.obolibrary.org/obo/ENVO_01000198"
"tectonic earthquake"	"http://purl.obolibrary.org/obo/envo#environmental_hazards"	"An earthquake caused by the sudden release of energy accumulated in an astronomical body's crust, as the elastic strain placed on constituent rock masses causes them to fracture."	"http://purl.obolibrary.org/obo/ENVO_01000678"
"methane clathrate"	"http://purl.obolibrary.org/obo/envo#envoPolar"	"A clathrate material in which a large amount of methane is trapped within a crystal structure of water, forming a solid similar to ice."	"http://purl.obolibrary.org/obo/ENVO_01000851"
"planetary subsurface environment"	"http://purl.obolibrary.org/obo/envo#envoOmics"	"An environmental system which has its properties and dynamics determined by the subsurface zone of a planet."	"http://purl.obolibrary.org/obo/ENVO_01001046"
"estuarine tidal riverine coastal surface layer"	"http://purl.obolibrary.org/obo/envo#envoCmecs"	"A layer of fresh estuarine water which extends a few centimeters from the surface of the water column towards the estuary bed and from the land-water interface to a fiat boundary where the estuary bed below the water column reaches a depth of 4 meters."	"http://purl.obolibrary.org/obo/ENVO_01001317"
"lake-effect snowfall"	"http://purl.obolibrary.org/obo/envo#envoPolar"	"Snowfall which 1) is localized, 2) is convective, and 3) occurs as a result of a cold, dry air mass absorbing heat and moisture as it flows over a lake with warmer waters."	"http://purl.obolibrary.org/obo/ENVO_03400006"
"glacial ice ablation zone"	"http://purl.obolibrary.org/obo/envo#envoPolar"	"An ablation zone which is part of a glacier."	"http://purl.obolibrary.org/obo/ENVO_03000037"
"mesoplanet"	"http://purl.obolibrary.org/obo/envo#envoAstro"	"A planet which is smaller than Mercury but larger than Ceres."	"http://purl.obolibrary.org/obo/ENVO_01001152"
"material accumulation process"	"http://purl.obolibrary.org/obo/envo#envoPolar"	"A process during which the mass of one or more materials, present within a given site, increases."	"http://purl.obolibrary.org/obo/ENVO_03000009"
"area of ice cover"	"http://purl.obolibrary.org/obo/envo#envoCryo"	"An environmental zone which is covered or partially covered by ice."	"http://purl.obolibrary.org/obo/ENVO_03400016"
"granule of plastic foam"	"http://purl.obolibrary.org/obo/envo#envoPlastics"	"A piece of plastic foam which has a near-spherical or granular shape."	"http://purl.obolibrary.org/obo/ENVO_06105026"
"minor planet"	"http://purl.obolibrary.org/obo/envo#envoAstro"	"A minor planet is an astronomical object in direct orbit around the Sun that is neither a planet nor exclusively classified as a comet. Minor planets can be dwarf planets, asteroids, trojans, centaurs, Kuiper belt objects, and other trans-Neptunian objects."	"http://purl.obolibrary.org/obo/ENVO_01000809"
"ice cap ridge"	"http://purl.obolibrary.org/obo/envo#envoPolar"	"A linear elevation on an icecap."	"http://purl.obolibrary.org/obo/ENVO_00000528"
"thermokarst depression"	"http://purl.obolibrary.org/obo/envo#envoPolar"	"A geographic basin which is formed due to the erosion of thermokarst by meltwater released from thawing permafrost."	"http://purl.obolibrary.org/obo/ENVO_03000084"
"tundra climate"	"http://purl.obolibrary.org/obo/envo#envoCryo"	"A climate which 1) has a mean temperature for the warmest month of less than 10°C (50°F), but higher than 0°C (32°F), 2) is not conducive to a permanent surficial cover of snow or ice, and 3) supports a tundra ecosystem."	"http://purl.obolibrary.org/obo/ENVO_03000140"
"freshwater lake"	"http://purl.obolibrary.org/obo/envo#envoPolar"	"A lake of whose water contains low concentrations of salts."	"http://purl.obolibrary.org/obo/ENVO_00000021"
"tundra ecosystem"	"http://purl.obolibrary.org/obo/envo#envoPolar"	"An ecosystem which 1) typically has monthly average temperatures below 10 degrees Celsius 2) has a low evapotranspiration ratio 3) is dominated by treeless terrain, covered by communities of low-growing vegetation such as dwarf shrubs, sedges and grasses, mosses, and lichens, 4) contains areas of soil underlain by permafrost with a thin active layer and 5) occurs in both polar and alpine regions (i.e., both high latitudes and high altitudes), and 5) does not have permanent snow or ice cover."	"http://purl.obolibrary.org/obo/ENVO_01001370"
"marine current"	"http://purl.obolibrary.org/obo/envo#envoPolar"	"A water current which is maintained by a continuous, directed movement of marine water, generated by forces caused by breaking waves, wind, Coriolis force, temperature and salinity differences, and tides caused by the gravitational pull of astronomical bodies. Depth contours, shoreline configurations and interaction with other currents influence a current's direction and strength."	"http://purl.obolibrary.org/obo/ENVO_01000067"
"area of perennial water ice"	"http://purl.obolibrary.org/obo/envo#envoPolar"	"An area of a planet's surface which is primarily composed of water ice, present throughout multiple years, in contact with an atmospheric column extending from the planetary boundary layer to the planet's exosphere with little to no physical obstruction."	"http://purl.obolibrary.org/obo/ENVO_01000740"
"ice lens"	"http://purl.obolibrary.org/obo/envo#envoPolar"	"An ice mass which is formed when moisture, diffused within soil or rock, accumulates and freezes in a localized zone, wedging soil or rock apart."	"http://purl.obolibrary.org/obo/ENVO_01000279"
"polar biome"	"http://purl.obolibrary.org/obo/envo#envoPolar"	"A biome which is subject to polar climatic conditions."	"http://purl.obolibrary.org/obo/ENVO_01000339"
"area of attached mussel assemblages"	"http://purl.obolibrary.org/obo/envo#envoCmecs"	"An area which is dominated by dense accumulations of mussels attached to a substrate other than conspecifics, including the associated faunal communities and predators present on the mussels (e.g., starfish)."	"http://purl.obolibrary.org/obo/ENVO_01001382"
"glacial ice gain"	"http://purl.obolibrary.org/obo/envo#envoPolar"	"A process during which the mass of ice constituting a glacier increases."	"http://purl.obolibrary.org/obo/ENVO_03000029"
"Bathymodiolus-dominated oceanic mussel bed"	"http://purl.obolibrary.org/obo/envo#envoMarine"	"An oceanic mussel bed which has mussel communities dominated by members of the genus Bathymodiolus."	"http://purl.obolibrary.org/obo/ENVO_01001390"
"brine channel formation process"	"http://purl.obolibrary.org/obo/envo#envoPolar"	"A material accumulation process during which brine droplets, trapped between ice crystals formed during seawater freezing, form brine channels."	"http://purl.obolibrary.org/obo/ENVO_03000042"
"mass gaseous flow"	"http://purl.obolibrary.org/obo/envo#envoAtmo"	"A process whereby a large volume of gas moves due to a disequilibrium of physical forces."	"http://purl.obolibrary.org/obo/ENVO_01000792"
"estuarine tidal riverine open water lower water column"	"http://purl.obolibrary.org/obo/envo#envoCmecs"	"A layer of fresh estuarine water which extends from an estuarine pycnocline or mid-depth to the estuary bed and from a fiat boundary where the estuary bed below the water column reaches a depth of 4 meters to end of the estuary most distal from the coast."	"http://purl.obolibrary.org/obo/ENVO_01001329"
"permafrost"	"http://purl.obolibrary.org/obo/envo#envoPolar"	"An environmental material which is 1) composed primarily of soil or rock and included ice or organic material and 2) at or below the freezing point of water for two or more years."	"http://purl.obolibrary.org/obo/ENVO_00000134"
"environmental zone"	"http://purl.obolibrary.org/obo/envo#envoPolar"	"A site which has its extent determined by the presence or influence of one or more components of an environmental system or the processes occurring therein."	"http://purl.obolibrary.org/obo/ENVO_01000408"
"foehn wind"	"http://purl.obolibrary.org/obo/envo#envoAtmo"	"A downslope katabatic wind during which warm, dry atmospheric gas descends along the lee side of a mountain range as a result of synoptic-scale, cross-barrier flow over that range."	"http://purl.obolibrary.org/obo/ENVO_01001722"
"cirrus homogenitus cloud"	"http://purl.obolibrary.org/obo/envo#envoAtmo"	"A cloud which is cirriform and is formed by condensation events centred on an aircraft's contrail."	"http://purl.obolibrary.org/obo/ENVO_01001159"
"planetary subsurface environment"	"http://purl.obolibrary.org/obo/envo#envoMeo"	"An environmental system which has its properties and dynamics determined by the subsurface zone of a planet."	"http://purl.obolibrary.org/obo/ENVO_01001046"
"wet pitfall trap"	"http://purl.obolibrary.org/obo/envo#envoCesab"	"A pitfall trap in which the container used to hold trapped animals is filled with a liquid solution formulated to hold, kill, and preserve any animal or animals which falls within it."	"http://purl.obolibrary.org/obo/ENVO_01000978"
"underground lake"	"http://purl.obolibrary.org/obo/envo#envoPolar"	"A lake which is formed under the surface of the Earth. Such a lake may be associated with caves and aquifers and springs."	"http://purl.obolibrary.org/obo/ENVO_00000058"
"area of open water"	"http://purl.obolibrary.org/obo/envo#nlcd2011"	"An area of a planet's surface which is primarily composed of water in contact with an atmospheric column extending from the planetary boundary layer to the planet's exosphere with little to no physical obstruction."	"http://purl.obolibrary.org/obo/ENVO_01000666"
"root"	"http://purl.obolibrary.org/obo/po#Maize"	"A plant axis (PO:0025004) that lacks shoot axis nodes (PO:0005004) and usually grows indeterminately."	"http://purl.obolibrary.org/obo/PO_0009005"
"coastal flood"	"http://purl.obolibrary.org/obo/envo#environmental_hazards"	"A coastal flood is a flood which is formed as a result of large amounts of water from marine water bodies or large lakes being transported to usually dry land by displacement processes such as high winds or seismic activity."	"http://purl.obolibrary.org/obo/ENVO_01000711"
"area of perennial ice or snow"	"http://purl.obolibrary.org/obo/envo#nlcd2011"	"An area of a planet's surface which is primarily composed of snow or water ice, present throughout multiple years, in contact with an atmospheric column extending from the planetary boundary layer to the planet's exosphere with little to no physical obstruction."	"http://purl.obolibrary.org/obo/ENVO_01000746"
"atmosphere-ocean momentum transfer process"	"http://purl.obolibrary.org/obo/envo#envoMarine"	"A momentum transfer process which unfolds as winds generate drag at the bottom of the atmosphere,coupled to dynamical forcing at the surface of the ocean."	"http://purl.obolibrary.org/obo/ENVO_01001843"
"falling snow"	"http://purl.obolibrary.org/obo/envo#envoCryo"	"An object aggregate which is composed primarily of snow falling through an atmosphere."	"http://purl.obolibrary.org/obo/ENVO_03400013"
"area of cropland"	"http://purl.obolibrary.org/obo/envo#nlcd2011"	"An area of a planet's surface which is partly covered either by annual crops and perennial woody crops or by actively tilled land. This area is in contact with an atmospheric column extending from the planetary boundary layer to the planet's exosphere with little to no physical obstruction."	"http://purl.obolibrary.org/obo/ENVO_01000892"
"ultraviolet stellar radiation"	"http://purl.obolibrary.org/obo/envo#environmental_hazards"	"A stellar radiation process during which electromagnetic waves or their quanta are emitted from a star at wavelengths between 10 nm and 400 nm."	"http://purl.obolibrary.org/obo/ENVO_01001216"
"marine biome"	"http://purl.obolibrary.org/obo/envo#envoPolar"	"A marine ecosystem which is in its climactic successional state."	"http://purl.obolibrary.org/obo/ENVO_00000447"
"marine wind mixed layer"	"http://purl.obolibrary.org/obo/envo#envoMarine"	"The upper part of the marine water column with generally uniform properties resulting from wind-driven mixing."	"http://purl.obolibrary.org/obo/ENVO_01000061"
"lower montane"	"http://purl.obolibrary.org/obo/envo#envoPolar"	"A lower montane condition is a montane condition in which an altitude range falls immediately above mid-altitude forests."	"http://purl.obolibrary.org/obo/ENVO_01000346"
