?label	?definition	?exactSynonym	?broadSynonym	?narrowSynonym	?relatedSynonym	?subsetType	?uri
"coral bleaching process"	"An environmental process in which coral expels the symbiotic algae living in its tissue as a result of stress, causing the coral to turn white."				"coral bleaching"		"http://purl.obolibrary.org/obo/ENVO_01000852"
"coral reef"	"A marine reef which is composed primarily of aragonite structures produced by living organisms, found in shallow, low-nutrient waters."	"CoralReef"			"barrier reef|reef|fringing reef"	"http://purl.obolibrary.org/obo/ENVO_03605018"	"http://purl.obolibrary.org/obo/ENVO_00000150"
"cork"	"Plant matter consisting of an impermeable buoyant material, the phellem layer of bark tissue."						"http://purl.obolibrary.org/obo/ENVO_03501302"
"corn exchange"	"A commercial building where merchants trade grains."	"grain exchange"					"http://purl.obolibrary.org/obo/ENVO_03501275"
"coronary care unit facility"	"A hospital unit facility which is used to provide cardiac patient care."	"cardiac care unit|CICU|cardiac intensive care unit|CCU|cardiac intensive card ward|CCW|cardiac care ward coronary care ward"					"http://purl.obolibrary.org/obo/ENVO_03501141"
"cosmetic product"	"A manufactured product which has been formulated to modifying the appearance of external human anatomical parts."						"http://purl.obolibrary.org/obo/ENVO_00003893"
"cosmic ray shielding disposition"	"A radiation shielding disposition which inheres in a material or immaterial entity which attenuates or blocks cosmic rays."						"http://purl.obolibrary.org/obo/ENVO_01001196"
"cosmogenous sediment"	"Cosmogenous sediment is derived from extraterrestrial dust and debris in the form of meteorites and similar entities."						"http://purl.obolibrary.org/obo/ENVO_01000111"
"cotton dust"							"http://purl.obolibrary.org/obo/ENVO_02000108"
"cotton plantation"			"agricultural site"				"http://purl.obolibrary.org/obo/ENVO_00000288"
"cove"	"A circular or round inlet with a narrow entrance."						"http://purl.obolibrary.org/obo/ENVO_00000138"
"covered latrine"	"A covered latrine is a building which comprises a latrine sheltered by an outhouse."						"http://purl.obolibrary.org/obo/ENVO_01000531"
"covered pit latrine"	"A covered pit latrine is a building which comprises a pit latrine sheltered by an outhouse."						"http://purl.obolibrary.org/obo/ENVO_01000532"
"covered pit latrine with slab floor"	"A covered pit latrine with slab is a building which comprises a pit latrine with a slab floor sheltered by an outhouse."						"http://purl.obolibrary.org/obo/ENVO_01000533"
"cow shed"	"An animal house which is used to shelter cows."	"cowhouse|cow barn|cowshed|cattle shed|cow house|byre"		"milking shed"			"http://purl.obolibrary.org/obo/ENVO_00003041"
"crater"	"A generally circular saucer or bowl-shaped depression caused by explosive action."	"CRATER"				"http://purl.obolibrary.org/obo/ENVO_03605014"	"http://purl.obolibrary.org/obo/ENVO_00000514"
"crater lake"	"A lake contained within a crater."						"http://purl.obolibrary.org/obo/ENVO_01001062"
"crater zone"	"The site which is located in a crater."						"http://purl.obolibrary.org/obo/ENVO_01001355"
"creamery"	"A creamery is a part of a dairy where cream is separated from whole milk."						"http://purl.obolibrary.org/obo/ENVO_00003967"
"creosote"	"The portion of chemical products obtained by the distillation of a tar that remains heavier than water, notably useful for its anti-septic and preservative properties"						"http://purl.obolibrary.org/obo/ENVO_2000001"
"creosote contaminated soil"	"Soil which has elevated concentrations of creosote."						"http://purl.obolibrary.org/obo/ENVO_00002117"
"crevasse"	"A deep fissure in snow or ice."	"CREVASSE"			"fissure|cleft"		"http://purl.obolibrary.org/obo/ENVO_00000320"
"crevice"	"A deep fissure in rock."				"crevice"		"http://purl.obolibrary.org/obo/ENVO_01000294"
"crocodilian nest"	"An animal habitation that is assembled by an organism in the order Crocodylia (alligators, crocodiles, caimans, and gharials). These habitations (nests), are typically built in freshwater or brackish environments. They can be mound nests, made from vegetation, mud, and organic material, or hole nests, excavated in sandy or muddy banks. These nests serve as sites for egg laying, incubation, and initial care of the young."	"nest of crocodylian|nest of crocodilian"					"http://purl.obolibrary.org/obo/ENVO_02000164"
"crop canopy"	"A canopy which is composed of the aboveground portion, or crowns, of a community of crop plants."					"http://purl.obolibrary.org/obo/ENVO_03605023"	"http://purl.obolibrary.org/obo/ENVO_01001241"
"cropland biome"	"A cropland ecosystem which is in its climactic successional state."					"http://purl.obolibrary.org/obo/ENVO_03605013|http://purl.obolibrary.org/obo/ENVO_03605022"	"http://purl.obolibrary.org/obo/ENVO_01000245"
"cropland ecosystem"	"An ecosystem which 1) is determined by communities of annual crops, perennial woody crops, or by actively tilled land, 2) is primarily used for agricultural activity, and 3) contains no village or larger human settlement."						"http://purl.obolibrary.org/obo/ENVO_01001244"
"crustacean farming process"	"An aquaculture process during which humans rear crustaceans."	"crustacean aquaculture"			"aquaculture of crustaceans"		"http://purl.obolibrary.org/obo/ENVO_01001249"
"crustal fluid"	"Fluid environmental material which is present in the continental crust and dictates the nature and extent of crustal deformation."						"http://purl.obolibrary.org/obo/ENVO_03600082"
"cryoconite deposit"	"Particulate environmental material which is composed primarily of dust, rock, and soot, as well as the microbial communities associated with these materials, deposited on an ice mass by an aeolian process."					"http://purl.obolibrary.org/obo/envo#envoPolar"	"http://purl.obolibrary.org/obo/ENVO_03000038"
"cryoconite hole"	"A vertical thaw hole within an ice mass, formed as a result of ice melt associated with local temperature increases, due to increased absorption of solar radiation by cryoconite deposits."	"cryoconite holes"				"http://purl.obolibrary.org/obo/envo#envoPolar|http://purl.obolibrary.org/obo/ENVO_03605025"	"http://purl.obolibrary.org/obo/ENVO_03000039"
"cryoform"	"A solid astronomical body part which is primarily composed of a continuous mass of snow and/or ice."					"http://purl.obolibrary.org/obo/envo#envoPolar"	"http://purl.obolibrary.org/obo/ENVO_03000110"
"cryopeg"	"A layer which is composed of ground that 1) remains unfrozen due to increased solute concentration and 2) is present within a mass of permafrost."					"http://purl.obolibrary.org/obo/envo#envoPolar|http://purl.obolibrary.org/obo/envo#envoNceas"	"http://purl.obolibrary.org/obo/ENVO_01001559"
"cryosol"	"Cryosols comprise mineral soils formed in a permafrost environment. Where water is present, it occurs primarily in the form of ice. Cryogenic processes are the dominant soil-forming processes."				"gelisol"	"http://purl.obolibrary.org/obo/envo#envoPolar|http://purl.obolibrary.org/obo/ENVO_03605015"	"http://purl.obolibrary.org/obo/ENVO_00002236"
"cryosphere"	"An astronomical body part which is composed primarily of environmental materials in their frozen form."					"http://purl.obolibrary.org/obo/envo#envoCryo|http://purl.obolibrary.org/obo/envo#envoPolar"	"http://purl.obolibrary.org/obo/ENVO_03000143"
"cryospheric layer"	"A layer which is part of a cryosphere."					"http://purl.obolibrary.org/obo/envo#envoPolar"	"http://purl.obolibrary.org/obo/ENVO_01001609"
"cryoturbation of soil"	"A frost action process during which soil is displaced."						"http://purl.obolibrary.org/obo/ENVO_01001664"
"crystal"	"A solid material whose constituents, such as atoms, molecules or ions, are arranged in a highly ordered microscopic structure, forming a crystal lattice that extends in all directions."						"http://purl.obolibrary.org/obo/ENVO_01000845"
"cultivated environment"	"A cultivated environment is an environment that has been modified by humans by the preparation of the land, usually for the purposes of growing crops."			"cropland"	"truck garden|range|agricultural region|market garden|cultivated cropland|cultivated area|truck farm|CROPLAND"		"http://purl.obolibrary.org/obo/ENVO_01000311"
"cultured organic material"							"http://purl.obolibrary.org/obo/ENVO_01001820"
"culturing environment"	"A culturing environment is an environment which is maintained by humans for the purposes of preparing cell, organ, tissue and plant tissue cultures."						"http://purl.obolibrary.org/obo/ENVO_01000312"
"cumulonimbus cloud"	"A cloud which 1) has been shaped into dense, mountain-like forms or one or more tower-like forms with a flattened upper portion, which often spreads out in the shape of an anvil or plume, 2) is composed of water droplets and, especially in its upper portion, ice crystals, 3) is located in the low level of the atmosphere (low étage), but can extend into the middle and high level of the atmosphere."	"Gewitterwolke|Cumulonibus-Wolke"				"http://purl.obolibrary.org/obo/envo#envoAtmo|http://purl.obolibrary.org/obo/envo#envoCloudAtlas"	"http://purl.obolibrary.org/obo/ENVO_01001419"
"cumulus cloud"	"A cloud which 1) has been shaped into rising mounds, domes, or towers with a bulging upper part resembling a cauliflower and a near horizontal or ragged base, 2) is mainly composed of water droplets, 3) is located in the low level of the atmosphere (low étage)."	"Kumuluswolke|Haufenwolke|Cumuluswolke|Quellwolke"				"http://purl.obolibrary.org/obo/envo#envoAtmo|http://purl.obolibrary.org/obo/envo#envoCloudAtlas"	"http://purl.obolibrary.org/obo/ENVO_01001414"
"cup"	"A utensil which is a hand-sized container with an open top."						"http://purl.obolibrary.org/obo/ENVO_03501330"
"cupboard"	"A cupboard is a cabinet which is used indoors to store household objects such as food, crockery, textiles and liquor, and to protect them from dust and dirt"				"closet"		"http://purl.obolibrary.org/obo/ENVO_01000595"
"currency note"	"A paper product which is used as legal tender in economic or other monetary trasactions."	"bank note"					"http://purl.obolibrary.org/obo/ENVO_00003896"
"cut"	"An excavation of the Earth's surface to provide passage for a road, railway, canal, etc."	"cutting|CUT"					"http://purl.obolibrary.org/obo/ENVO_00000474"
"cutoff"	"A channel formed as a result of a stream cutting through a meander neck."	"cut off|cutoff (hydrographic)|cuttoff"					"http://purl.obolibrary.org/obo/ENVO_00000523"
"cyanobacterial bloom"	"A feature which arises from a rapid multiplication of cyanobacteria, causing marked visible discoloration of the water."					"http://purl.obolibrary.org/obo/ENVO_03605018"	"http://purl.obolibrary.org/obo/ENVO_03600071"
"cyclone"	"An atmospheric storm during which a large mass of atmospheric gas rotates around a centre of low atmospheric pressure, generating high winds which spiral towards that centre."					"http://purl.obolibrary.org/obo/envo#envoAtmo|http://purl.obolibrary.org/obo/envo#environmental_hazards"	"http://purl.obolibrary.org/obo/ENVO_01001297"
"cyclonic circulation"	"A mass fluid flow which moves  in the same direction as a planet's rotation, rotating due to a Coriolis effect."	"cyclonic rotation"				"http://purl.obolibrary.org/obo/envo#envoAtmo|http://purl.obolibrary.org/obo/envo#envoPolar|http://purl.obolibrary.org/obo/envo#envoMarine"	"http://purl.obolibrary.org/obo/ENVO_01001748"
"cypress dome"	"A cypress dome swamp is a dome swamp which has a plant community dominated by Cupressaceae, often swamp cypresses. Swamp cypresses typically belong to the genus Taxodium or the species Glyptostrobus pensilis and Actinostrobus pyramidalis."	"cypress dome swamp"					"http://purl.obolibrary.org/obo/ENVO_01000329"
"cypress strand swamp"	"A cypress strand swamp is a strand swamp which has a plant community dominated by Cupressaceae, often swamp cypresses. Swamp cypresses typically belong to the genus Taxodium or the species Glyptostrobus pensilis and Actinostrobus pyramidalis."	"cypress strand"					"http://purl.obolibrary.org/obo/ENVO_01000330"
"cypress swamp"	"A cypress swamp is a swamp which has a plant community dominated by Cupressaceae, often swamp cypresses. Swamp cypresses typically belong to the genus Taxodium or the species Glyptostrobus pensilis and Actinostrobus pyramidalis."						"http://purl.obolibrary.org/obo/ENVO_01000331"
"dacite"	"Dacite is an igneous, volcanic rock. It has an aphanitic to porphyritic texture and is intermediate in composition between andesite and rhyolite.  Dacite consists mostly of plagioclase feldspar with biotite, hornblende, and pyroxene (augite and/or enstatite). It has quartz as rounded, corroded phenocrysts, or as an element of the ground-mass. The plagioclase ranges from oligoclase to andesine and labradorite. Sanidine occurs, although in small proportions, in some dacites, and when abundant gives rise to rocks that form transitions to the rhyolites."						"http://purl.obolibrary.org/obo/ENVO_01000442"
"dacitic lava"	"Lava which is high in silica and low in alkali metal oxides."						"http://purl.obolibrary.org/obo/ENVO_01000444"
"dacitic volcano"	"A volcano which has been formed as a result of the eruption of dacitic lava."						"http://purl.obolibrary.org/obo/ENVO_01000440"
"dairy"	"A dairy is a building in which animal milk is harvested and, optionally, processed for human consumption."						"http://purl.obolibrary.org/obo/ENVO_00003862"
"dairy farm"	"A farm which produces milk or products derived from milk."						"http://purl.obolibrary.org/obo/ENVO_03501120"
"dam"	"A barrier constructed across a watercourse to control the flow or raise the level of water."				"barrage|dam site"		"http://purl.obolibrary.org/obo/ENVO_00000074"
"dambo"	"A class of complex shallow wetlands in central, southern and eastern Africa, particularly in Zambia and Zimbabwe. They are generally found in higher rainfall flat plateau areas, and have river-like branching forms which may be nowhere very large, but common enough to add up to a large area."						"http://purl.obolibrary.org/obo/ENVO_00000236"
"day"	"A one-dimensional temporal region which spans the duration an astronomical body completes one rotation on its axis."						"http://purl.obolibrary.org/obo/ENVO_01003005"
"day care building"	"A building which is used to care for a human child during the working day by a person, outside the child's immediate family, other than that child's legal guardians."	"daycare building|child care building"					"http://purl.obolibrary.org/obo/ENVO_01000927"
"day care facility"	"A child care facility in which day care services are provided, by specialized staff and equipment, to a human child during the working day."	"daycare facility|daycare"					"http://purl.obolibrary.org/obo/ENVO_03501335"
"dead cave"	"A cave without streams or drips of water."	"dry cave"					"http://purl.obolibrary.org/obo/ENVO_00000030"
"dead flame paraffin lantern"	"A dead-flame paraffin lantern is a paraffin lantern which has a wick housed in a glass globe with airflow channelled upwards by vents below the burning wick and an open chimney above it."	"glass globe lantern"					"http://purl.obolibrary.org/obo/ENVO_01000569"
"debris flow"	"A mass wasting flow during which water-laden masses of soil and fragmented rock rush down the slopes of elevations, funnel into stream channels, entrain objects in their paths, and form thick, muddy deposits on valley floors."					"http://purl.obolibrary.org/obo/envo#environmental_hazards"	"http://purl.obolibrary.org/obo/ENVO_01000698"
"debris flow following rainfall"	"A debris flow which is causally preceded by rainfall."						"http://purl.obolibrary.org/obo/ENVO_01001875"
"dedicated campground"	"A campground which has been modified by humans to provide and maintain facilities for camping such as fire pits, road access, latrines, and garbage bins."						"http://purl.obolibrary.org/obo/ENVO_01000936"
"deep chlorophyll maximum layer"	"A subsurface layer in a water body, typically an ocean or lake, in which chlorophyll concentrations reach their maximum."	"DCM"			"subsurface chlorophyll maximum layer"	"http://purl.obolibrary.org/obo/envo#envoPolar"	"http://purl.obolibrary.org/obo/ENVO_01000326"
"deep marine sediment"	"Sediment that accumulates in the flat or very gently sloping areas of the deep ocean basin floor. The three main types of deep marine sediment, also known as pelagic sediment, are siliceous oozes, calcareous oozes, and red clays."	"deep marine sediments"			"pelagic sediment {alternative name}"	"http://purl.obolibrary.org/obo/envo#envoPolar"	"http://purl.obolibrary.org/obo/ENVO_00002113"
"deep ocean current"	"A marine current that generally occurs below the permanent thermocline (where it occurs) or below 400 m depth and that is driven by density and temperature gradients."						"http://purl.obolibrary.org/obo/ENVO_01000098"
"defence against flooding"	"A planned process during which an environmental system is modified to mitigate or nullify the impacts of flooding."	"defense against flooding"			"defence against floods|defense against floods|flood defence|flood defense intervention|flood defense|flood defence intervention"		"http://purl.obolibrary.org/obo/ENVO_01001210"
"deforestation"	"An ecosystem process during which the flora and fauna belonging to a forest are removed or destroyed."		"clearing|clearance"				"http://purl.obolibrary.org/obo/ENVO_02500012"
"degradation of toxins from algal bloom process"							"http://purl.obolibrary.org/obo/ENVO_02500025"
"degreaser"	"A cleaning agent which 1) contains organic solvents and 2) dissolves oils and fats for the removal of grease."	"solvent degreaser"					"http://purl.obolibrary.org/obo/ENVO_03510020"
"deionisation"	"A process during which ion exchange chemistry is used to replace one class of ions with another."	"deionization"					"http://purl.obolibrary.org/obo/ENVO_01001945"
"deionised water"	"Liquid water which is the output of a deionisation process."						"http://purl.obolibrary.org/obo/ENVO_01001947"
"delicatessen"	"A food shop which sells a selection of food products that are not typical dietary components of the human population it is co-located with."	"deli"					"http://purl.obolibrary.org/obo/ENVO_01000970"
"dell"	"A small wooded valley, either U- or V-shaped."		"valley"				"http://purl.obolibrary.org/obo/ENVO_00000439"
"delta"	"A landform which is composed of a tract of alluvium formed at the mouth of a river, where the deposition of some of its load exceeds its rate of removal, crossed by the divergent channels (distributaries) of the river."				"canyon delta|outwash|fan|pass (delta)|bay delta|outwash plain|fan delta|alluvial fan"	"http://purl.obolibrary.org/obo/ENVO_03605014"	"http://purl.obolibrary.org/obo/ENVO_00000101"
"demilitarized zone"	"A geographical area, usually the frontier or boundary between two or more military powers (or alliances), where military activity is not permitted, usually by peace treaty, armistice or other bilateral or multilateral agreement."	"neutral zone|DEMILITIARIZED ZONE|DMZ"	"adminstrative area"		"boundary"		"http://purl.obolibrary.org/obo/ENVO_00000136"
"dense settlement"	"A settlement with a high density of buildings and inhabitants."						"http://purl.obolibrary.org/obo/ENVO_01000658"
"dense settlement biome"	"A dense settlement biome is an anthropogenic terrestrial biome which is primarily used for human habitation, recreation, and industry within built structures with little other land use."						"http://purl.obolibrary.org/obo/ENVO_01000248"
"dental clinic"	"A medical clinic which is used to provide medical services focused on maintaining and improving the oral health of clients."	"dentist clinic|dentist office|dental office"					"http://purl.obolibrary.org/obo/ENVO_03501185"
"depositional island"	"An island formed by deposition of solid material such as sand or small rocks where a water current loses some of its carrying capacity."						"http://purl.obolibrary.org/obo/ENVO_1000750"
"depositional process"	"A process during which material entities are added to a landform or to a feature upon the landform."					"http://purl.obolibrary.org/obo/envo#envoPolar"	"http://purl.obolibrary.org/obo/ENVO_03000054"
"depressed landform"	"A landform sunken or depressed below the surrounding area."		"depression"		"non tidal basin|pans|pan (geologic)|pan|depression|tidal basin|barrier basin"		"http://purl.obolibrary.org/obo/ENVO_00000309"
"depth hoar"	"Hoar which is usually cup-shaped and facetted and which forms within dry, low-density snow beneath the snow surface."						"http://purl.obolibrary.org/obo/ENVO_01001846"
"depth of snow"	"The depth of some snow."	"snow depth"			"snow cover"	"http://purl.obolibrary.org/obo/envo#envoPolar|http://purl.obolibrary.org/obo/envo#envoCryo"	"http://purl.obolibrary.org/obo/ENVO_09200023"
"depth of water"	"The depth of some water."	"water depth"					"http://purl.obolibrary.org/obo/ENVO_3100031"
"depth of water ice"	"The depth of some water ice."					"http://purl.obolibrary.org/obo/envo#envoPolar|http://purl.obolibrary.org/obo/envo#envoCryo"	"http://purl.obolibrary.org/obo/ENVO_03400017"
"derives from part of"	"A relation between two distinct material entities, the new entity and the old entity, in which the new entity begins to exist through the separation or transformation of a part of the old entity, and the new entity inherits a significant portion of the matter belonging to that part of the old entity."						"http://purl.obolibrary.org/obo/ENVO_01003004"
"desalinated water"	"Saline water from which minerals have been removed to produce fresh water suitable for human consumption or irrigation."					"http://purl.obolibrary.org/obo/ENVO_03605019"	"http://purl.obolibrary.org/obo/ENVO_06105269"
"desalination process"	"A recycling process during which the dissolved mineral salts in water are removed"						"http://purl.obolibrary.org/obo/ENVO_06105301"
"desert"	"A landform which has been rendered barren or partially barren by environmental extremes, especially by low rainfall, and which loses more liquid water by evapotranspiration than is supplied by precipitation."					"http://purl.obolibrary.org/obo/ENVO_03605023|http://purl.obolibrary.org/obo/ENVO_03605014"	"http://purl.obolibrary.org/obo/ENVO_01001357"
"desert area"	"A region rendered barren or partially barren by environmental extremes, especially by low rainfall."				"arid region"	"http://purl.obolibrary.org/obo/envo#envoPolar"	"http://purl.obolibrary.org/obo/ENVO_00000097"
"desert biome"	"A desert ecosystem which is in its climactic successional state."					"http://purl.obolibrary.org/obo/envo#wwfBiome"	"http://purl.obolibrary.org/obo/ENVO_01000179"
"desert ecosystem"	"An ecosystem in which the composition, structure, and function of resident ecological assemblages are primarily determined by a desert."						"http://purl.obolibrary.org/obo/ENVO_01001780"
"desert island"	"An island that is not permanently populated by humans."	"uninhabited island"		"islet|atoll"			"http://purl.obolibrary.org/obo/ENVO_03501242"
"desert oasis"	"A small, isolated, fertile or green area in a desert region, usually having a spring or well."						"http://purl.obolibrary.org/obo/ENVO_00000156"
"desert pavement"	"A desert surface covered with closely packed, interlocking angular or rounded rock fragments of pebble and cobble size."	"reg|saï|serir|gibber"					"http://purl.obolibrary.org/obo/ENVO_01000812"
"desert planet"	"A terrestrial planet which has a surface dominated by hot deserts."	"dry planet"				"http://purl.obolibrary.org/obo/envo#envoAstro"	"http://purl.obolibrary.org/obo/ENVO_01001135"
"desert sand"	"Sand which is part of a desert."						"http://purl.obolibrary.org/obo/ENVO_00005800"
"desert scrubland"	"A scrubland which is located in a desert."	"desert scrub"					"http://purl.obolibrary.org/obo/ENVO_01000242"
"desert spring"	"A spring that is located in the desert."					"http://purl.obolibrary.org/obo/ENVO_03605018"	"http://purl.obolibrary.org/obo/ENVO_02000139"
"desert tree line ecotone"	"A tree line ecotone across which trees cease to grow due to insufficient water availability due to a lack of water-based precipitation."	"desert treeline|desert tree-line|desert tree line"					"http://purl.obolibrary.org/obo/ENVO_01000955"
"desert-alpine tree line ecotone"	"A tree line ecotone across which trees cease to grow due to insufficient water availability caused by exposure to increased solar radiation and a lack of rainfall."	"desert-alpine treeline|desert-alpine tree-line|desert-alpine tree line"					"http://purl.obolibrary.org/obo/ENVO_01000956"
"desertification"	"A type of land degradation in which terrestrial ecosystem becomes increasingly dry, typically losing its bodies of water as well as vegetation and wildlife."						"http://purl.obolibrary.org/obo/ENVO_02500001"
"desk"	"A desk is a table which is intended for information-manipulation tasks, including writing and use of interactive electronics."						"http://purl.obolibrary.org/obo/ENVO_01000585"
"desublimation of water vapour into ice"	"A desublimation process during which water vapour is frozen into water ice."					"http://purl.obolibrary.org/obo/envo#envoPolar"	"http://purl.obolibrary.org/obo/ENVO_03000055"
"desublimation process"	"Desublimation is a process in which a portion of some gas undergoes a phase transition into a portion of some solid."		"deposition"				"http://purl.obolibrary.org/obo/ENVO_01000726"
"determinate root nodule"	"Determinate nodules are root nodules found on tropical (sub)legumes, such as those of the genera Glycine (soybean), Phaseolus  (common bean), Lotus, and Vigna. Determinate nodules lose meristematic activity shortly after initiation, thus growth is due to cell expansion resulting in mature nodules which are spherical in shape."						"http://purl.obolibrary.org/obo/ENVO_01000167"
