?label	?definition	?exactSynonym	?broadSynonym	?narrowSynonym	?relatedSynonym	?subsetType	?uri
"lake inlet"	"An opening of a lake into its shore."					"http://purl.obolibrary.org/obo/envo#envoPolar"	"http://purl.obolibrary.org/obo/ENVO_00000476"
"lake island"	"An island that lies in a lake."						"http://purl.obolibrary.org/obo/ENVO_00000424"
"lake layer"	"A layer which is part of a lake."					"http://purl.obolibrary.org/obo/envo#envoPolar"	"http://purl.obolibrary.org/obo/ENVO_01000283"
"lake sediment"	"Lake sediment is sediment which covers the bottom of a lake. Lake sediments are comprised mainly of clastic material (sediment of clay, silt, and sand sizes), organic debris, chemical precipitates, or combinations of these."				"SedimentLayer"		"http://purl.obolibrary.org/obo/ENVO_00000546"
"lake shore"	"That part of the land in immediate contact with a lake."				"lakeshore"		"http://purl.obolibrary.org/obo/ENVO_00000382"
"lake surface"							"http://purl.obolibrary.org/obo/ENVO_00000105"
"lake water"	"Water which is part of a lake."					"http://purl.obolibrary.org/obo/ENVO_03605019|http://purl.obolibrary.org/obo/envo#envoNceas"	"http://purl.obolibrary.org/obo/ENVO_04000007"
"lake with a hypoxic hypolimnion"	"A lake which has a hypolimnion composed primarily of hypoxic water."				"anoxic lake"		"http://purl.obolibrary.org/obo/ENVO_01001074"
"lake with an anoxic hypolimnion"	"A lake which has a hypolimnion composed primarily of anoxic water."				"anoxic lake"		"http://purl.obolibrary.org/obo/ENVO_01001073"
"lake with an oxic hypolimnion"	"A lake which has a hypolimnion composed primarily of oxic water."				"oxic lake|aerobic lake"		"http://purl.obolibrary.org/obo/ENVO_01001077"
"lake-effect snow storm"	"A snowstorm during which intense lake-effect snowfall occurs."	"lake effect snow storm"				"http://purl.obolibrary.org/obo/envo#envoCryo|http://purl.obolibrary.org/obo/envo#envoPolar"	"http://purl.obolibrary.org/obo/ENVO_03400007"
"lake-effect snowfall"	"Snowfall which 1) is localized, 2) is convective, and 3) occurs as a result of a cold, dry air mass absorbing heat and moisture as it flows over a lake with warmer waters."	"lake-effect snow|lake effect snow"				"http://purl.obolibrary.org/obo/envo#envoPolar|http://purl.obolibrary.org/obo/envo#envoCryo"	"http://purl.obolibrary.org/obo/ENVO_03400006"
"lambing storm"	"A snowfall which occurs during springtime and is of low intensity."	"lamb-blasts|lamb-showers|lamb storm"				"http://purl.obolibrary.org/obo/envo#envoCryo|http://purl.obolibrary.org/obo/envo#envoPolar"	"http://purl.obolibrary.org/obo/ENVO_03400008"
"lamp"	"A lamp is an object which generates heat, light, or any other form of radiation."						"http://purl.obolibrary.org/obo/ENVO_01000566"
"land"	"A surface layer of an astronomical body which is primarily composed of solid material and is not covered by oceans or other bodies of water."						"http://purl.obolibrary.org/obo/ENVO_01001785"
"land bridge"	"An isthmus or other land connection between what at other times are separate land masses which allows animals and plants to cross and colonise new lands. Land bridges are commonly created by regression, in which sea levels fall exposing previously submerged sections of continental shelf. Land bridges are also formed by: (a) upthrust at the edge of continental plates; and (b) glacial retreat alleviating pressure on shallow marine formations."						"http://purl.obolibrary.org/obo/ENVO_00000391"
"land consumption process"	"A process in which natural ecosystems present over an expanse of land are removed and replaced with anthropogenic ecosystems."						"http://purl.obolibrary.org/obo/ENVO_01000743"
"land conversion process"	"An anthropisation process during which terrestrial environments - natural or anthropised - or parts thereof are altered to facilitate human activities such as agriculture, settlement, or commerce."	"land development|land conversion"					"http://purl.obolibrary.org/obo/ENVO_01001429"
"land degradation"	"A process which diminishes the functioning of an ecosystem located on land."						"http://purl.obolibrary.org/obo/ENVO_02500005"
"land fire"	"A fire which occurs on land, typically consuming a terrestrial ecosystem as fuel."					"http://purl.obolibrary.org/obo/envo#environmental_hazards"	"http://purl.obolibrary.org/obo/ENVO_01001292"
"land ice mass"	"An ice mass which has formed over land."					"http://purl.obolibrary.org/obo/envo#envoPolar"	"http://purl.obolibrary.org/obo/ENVO_01001547"
"land use process"	"An anthropogenic environmental process which includes all human activities undertaken in a natural, semi-natural, or anthropised environment."						"http://purl.obolibrary.org/obo/ENVO_01001431"
"land-tied island"	"A continental island connected to its adjacent land by a natural feature, such as a causeway."		"island"		"land-tied island"		"http://purl.obolibrary.org/obo/ENVO_00000269"
"landfill"	"A depression which contains objects and materials discarded by humans or their technologies."	"垃圾掩埋場|discarica|rubbish dump|vertedero|garbage dump|Deponie"			"disposal site"	"http://purl.obolibrary.org/obo/ENVO_03605014|http://purl.obolibrary.org/obo/envo#envoPlastics"	"http://purl.obolibrary.org/obo/ENVO_00000533"
"landform"	"A solid astronomical body part which has been formed from and is composed primarily of the matter of that astronomical body."						"http://purl.obolibrary.org/obo/ENVO_01001886"
"landline telephone"	"A landline telephone is a telephone which is connected to a telephone network with wires through which electronic signals are carried."						"http://purl.obolibrary.org/obo/ENVO_01000582"
"landlocked sea"	"An inland sea which is not connected with an ocean by a lentic or lotic water body."		"lake"		"inland sea"	"http://purl.obolibrary.org/obo/envo#envoMarine"	"http://purl.obolibrary.org/obo/ENVO_00000219"
"landmass"	"A large continuous area of land, either surrounded by sea or contiguous with another landmass."						"http://purl.obolibrary.org/obo/ENVO_01001782"
"landscape macroscale age"	"Chronological age which inheres in a bearer by virtue of that bearer existing for between 10,000 and 1,000,000 years."						"http://purl.obolibrary.org/obo/ENVO_03620001"
"landscape macroscale size"	"An area quality which inheres in a bearer by virtue of that bearer having an area of between 10e10 and 10e12 square metres."						"http://purl.obolibrary.org/obo/ENVO_03620007"
"landscape megascale age"	"Chronological age which inheres in a bearer by virtue of that bearer existing for more than 1,000,000 years."						"http://purl.obolibrary.org/obo/ENVO_03620002"
"landscape megascale size"	"An area quality which inheres in a bearer by virtue of that bearer having an area of greater than 10e12 square meters."						"http://purl.obolibrary.org/obo/ENVO_03620008"
"landscape mesoscale age"	"Chronological age which inheres in a bearer by virtue of that bearer existing for between 500 and 10,000 years."						"http://purl.obolibrary.org/obo/ENVO_03620003"
"landscape mesoscale size"	"An area quality which inheres in a bearer by virtue of that bearer having an area of between 10e6 and 10e10 square metres."						"http://purl.obolibrary.org/obo/ENVO_03620006"
"landscape microscale age"	"Chronological age which inheres in a bearer by virtue of that bearer existing for between 1 and 500 years."						"http://purl.obolibrary.org/obo/ENVO_03620004"
"landscape microscale size"	"An area quality which inheres in a bearer by virtue of that bearer having an area of between 1 and 10e6 square metres."						"http://purl.obolibrary.org/obo/ENVO_03620005"
"landslide"	"A mound of earth material, at the base of a slope and the associated scoured area."		"physiographic feature"		"slide (natural)|landslip|slide"		"http://purl.obolibrary.org/obo/ENVO_00000520"
"landslide lake"	"A lake which fills a depression where drainage is blocked by solid material transported by a landslide."						"http://purl.obolibrary.org/obo/ENVO_01001106"
"landslide process"	"A landslide is a process whereby a large mass of earth and rocks moves down a hill or a mountainside."	"landslip"				"http://purl.obolibrary.org/obo/envo#environmental_hazards"	"http://purl.obolibrary.org/obo/ENVO_01000692"
"landspout"	"A tornado which a) is not associated with a mesocyclone and is thus relatively weak and short-lived, b) is centred on a small, smooth condensation funnel which often does not reach the planetary surface, and c) forms a distinctively laminar cloud of dust when it makes contact with the land."	"land spout|fair weather waterspout on land|dust-tube tornado"					"http://purl.obolibrary.org/obo/ENVO_01001486"
"lantern"	"A lantern is a portable device or mounted fixture comprising a light source protected by a translucent case."						"http://purl.obolibrary.org/obo/ENVO_01000565"
"large freshwater lake biome"	"A large freshwater lake ecosystem which is in its climactic successional state."					"http://purl.obolibrary.org/obo/envo#wwfBiome|http://purl.obolibrary.org/obo/ENVO_03605022|http://purl.obolibrary.org/obo/ENVO_03605017"	"http://purl.obolibrary.org/obo/ENVO_00000891"
"large freshwater lake ecosystem"	"A freshwater lake ecosystem which has its functions and composition determined by a large freshwater lake."						"http://purl.obolibrary.org/obo/ENVO_01001908"
"large freshwater river delta ecosystem"	"A large freshwater river ecosystem which has its functions and composition determined by its delta."						"http://purl.obolibrary.org/obo/ENVO_01001913"
"large freshwater river ecosystem"	"A freshwater river ecosystem which has its functions and composition determined by a large freshwater river."						"http://purl.obolibrary.org/obo/ENVO_01001911"
"large freshwater river headwater ecosystem"	"A large freshwater river ecosystem which has its functions and composition determined by its headwaters."						"http://purl.obolibrary.org/obo/ENVO_01001914"
"large river biome"	"A large freshwater river ecosystem which is in its climactic ecological state."					"http://purl.obolibrary.org/obo/envo#wwfBiome|http://purl.obolibrary.org/obo/ENVO_03605022|http://purl.obolibrary.org/obo/ENVO_03605017"	"http://purl.obolibrary.org/obo/ENVO_00000887"
"large river delta biome"	"A large freshwater river delta ecosystem which is in its climactic successional state."					"http://purl.obolibrary.org/obo/ENVO_03605022|http://purl.obolibrary.org/obo/envo#wwfBiome|http://purl.obolibrary.org/obo/ENVO_03605017|http://purl.obolibrary.org/obo/ENVO_03605021"	"http://purl.obolibrary.org/obo/ENVO_00000889"
"large river headwater biome"	"A large freshwater river headwater ecosystem which is in its climactic successional state."					"http://purl.obolibrary.org/obo/envo#wwfBiome|http://purl.obolibrary.org/obo/ENVO_03605022|http://purl.obolibrary.org/obo/ENVO_03605017"	"http://purl.obolibrary.org/obo/ENVO_00000888"
"lateral moraine"	"The parallel ridges of till deposited along the sides of an alglacier. The unconsolidated debris is deposited on top of the glacier by frost shattering of the valley walls and from tributary streams flowing into the valley. The till is carried along the glacial margin until the glacier melts."		"moraine"			"http://purl.obolibrary.org/obo/envo#envoPolar"	"http://purl.obolibrary.org/obo/ENVO_00000249"
"latex"	"A stable dispersion (emulsion) of polymer microparticles in an aqueous medium."	"Natural rubber, India rubber, Gum elastic, Non-vulcanized rubber"					"http://purl.obolibrary.org/obo/ENVO_03501324"
"latrine"	"A latrine is a toilet which is of simple construction (relative to a flush or chemical toilet) and typically intended for communal use."						"http://purl.obolibrary.org/obo/ENVO_01000519"
"latrine pit"	"A latrine pit is an artificial hole or cavity in the ground used to collect human excreta."						"http://purl.obolibrary.org/obo/ENVO_01000522"
"latrine slab"	"A latrine slab is a  broad, flat, thick piece of solid material (typically stone or concrete) used as the floor of a latrine and which includes a hole through which excreta are deposited into a latrine pit."						"http://purl.obolibrary.org/obo/ENVO_01000520"
"lava"	"Lava is a mixture of molten or semi-molten rock, volatiles, and solids which has extruded beyond a planetary crust."						"http://purl.obolibrary.org/obo/ENVO_01000231"
"lava field"	"A lava field is an expanse of flat-lying lava flows. Such features are generally composed of highly fluid basalt lava, and can extend for tens or even hundreds of miles across the underlying terrain."	"lava plain|lava bed|lava area"					"http://purl.obolibrary.org/obo/ENVO_01000437"
"lava flow"	"A lava flow is a moving outpouring of lava, which is created during a non-explosive effusive eruption."					"http://purl.obolibrary.org/obo/envo#environmental_hazards"	"http://purl.obolibrary.org/obo/ENVO_01000438"
"lava flow process"	"A process in which a volume of lava emitted during an effusive eruption moves along a solid surface."					"http://purl.obolibrary.org/obo/envo#environmental_hazards"	"http://purl.obolibrary.org/obo/ENVO_01000730"
"lava planet"	"A planet which has a surface layer that nearly completely or completely covered by lava, and which has a substantial portion of its mass composed of lava."					"http://purl.obolibrary.org/obo/envo#envoAstro"	"http://purl.obolibrary.org/obo/ENVO_01001143"
"lava tunnel"	"A tunnel formed by the flow of molten lava, which has subsequently drained out."	"lava tube"					"http://purl.obolibrary.org/obo/ENVO_00000110"
"lawn soil"	"Soil which is formulated to promote the growth of grasses or other plants used to establish managed areas of vegetation."					"http://purl.obolibrary.org/obo/ENVO_03605015"	"http://purl.obolibrary.org/obo/ENVO_00005756"
"layer"	"A material entity which 1) is spatially continuous, 2) is composed of material of comparable thickness, composition, and physical properties, and 3) is physically distinct from adjacent portions of environmental material."					"http://purl.obolibrary.org/obo/envo#envoPolar"	"http://purl.obolibrary.org/obo/ENVO_01000281"
"leachate"	"The liquid produced when water percolates through any permeable material. It can contain either dissolved or suspended material, or usually both."					"http://purl.obolibrary.org/obo/ENVO_03605019"	"http://purl.obolibrary.org/obo/ENVO_00002141"
"lead paint"	"Paint that contains lead."						"http://purl.obolibrary.org/obo/ENVO_02000124"
"lead solder"	"A solder which includes lead."						"http://purl.obolibrary.org/obo/ENVO_03500019"
"leafy wood soil"	"Soil which is part of a woodland dominated by leafy trees."					"http://purl.obolibrary.org/obo/ENVO_03605015"	"http://purl.obolibrary.org/obo/ENVO_00005783"
"leat"	"A man-made watercourse, or makeshift aqueduct, often an artificial channel which supplies water to a watermill or its mill pond, collecting water from upstream of the mill so that the natural level of the driving water is above the level of the stream at the mill. Alternatively to may deliver water for mineral washing and concentration, irrigation or to a dye works."	"lete"					"http://purl.obolibrary.org/obo/ENVO_00000544"
"leather dye"	"Pigments carried by solvents or water which are applied to leather to be absorbed into the pores of the leather to deposit coloration."						"http://purl.obolibrary.org/obo/ENVO_03510011"
"legal settlement"	"A settlement on land that the inhabitants have a legal claim to."						"http://purl.obolibrary.org/obo/ENVO_01000766"
"leisure centre"	"A public building or site which provides facilities used by people to keep fit or relax."						"http://purl.obolibrary.org/obo/ENVO_03501235"
"lentic water body"	"A lentic water body is a water body in which the accumulated water, in its totality, has very little to no directed flow."					"http://purl.obolibrary.org/obo/ENVO_03605025"	"http://purl.obolibrary.org/obo/ENVO_01000617"
"leptosol"	"Leptosols are very shallow soils over continuous rock and soils that are extremely gravelly and/or stony. Leptosols are azonal soils and particularly common in mountainous regions."			"stony soil|gravelly soil"		"http://purl.obolibrary.org/obo/ENVO_03605015"	"http://purl.obolibrary.org/obo/ENVO_00002241"
"letter"	"A written message from one person to another addressed to a person or organization."						"http://purl.obolibrary.org/obo/ENVO_02000081"
"letter paper"	"A paper product which has been manufactured to facilitate the writing of letters."						"http://purl.obolibrary.org/obo/ENVO_01001887"
"levee"	"An artificial slope or wall, usually earthen, which parallels the course of a river, built for the purpose of containing the river."				"berm|REVETMENT|dike (manmade)|dyke|revetment|EMBANKMENT|embankment|dike|levee"	"http://purl.obolibrary.org/obo/ENVO_03605014"	"http://purl.obolibrary.org/obo/ENVO_00000178"
"lichen material"	"An organic material which is derived from lichen mats."						"http://purl.obolibrary.org/obo/ENVO_03600084"
"lichen woodland"	"A woodland which has an understory partially covered by lichen mats and tundra-like vegetation."						"http://purl.obolibrary.org/obo/ENVO_01000949"
"light emitted by lightning"	"A photometeor which is formed as a result of sudden electrostatic discharge in the atmosphere."				"lightning flash|lightning"	"http://purl.obolibrary.org/obo/envo#envoAtmo"	"http://purl.obolibrary.org/obo/ENVO_01001011"
"light fraction material"	"An environmental material which is less dense than bromoform."						"http://purl.obolibrary.org/obo/ENVO_01001650"
"light switch"	"A switch which turns a light on or off."	"lightswitch"	"switch, dimmer switch"				"http://purl.obolibrary.org/obo/ENVO_03501213"
"lightning flash"	"A lightning process during which electrostatic discharge occurs within a single cloud or between multiple clouds."					"http://purl.obolibrary.org/obo/envo#environmental_hazards"	"http://purl.obolibrary.org/obo/ENVO_01000902"
"lightning strike"	"A lightning process during which electrostatic discharge occurs between a cloud and an object on a planetary surface, or a planetary surface itself."	"cloud-ground lightning|CG lightning"				"http://purl.obolibrary.org/obo/envo#environmental_hazards"	"http://purl.obolibrary.org/obo/ENVO_01000901"
"lignite"	"A soft, brown, combustible, sedimentary rock formed from naturally compressed peat."	"brown coal"					"http://purl.obolibrary.org/obo/ENVO_2000008"
"lignite power plant"							"http://purl.obolibrary.org/obo/ENVO_2000040"
"liman"	"A lake or estuary that is formed at the mouth of a river where flow is blocked by a bar of sediments. It can be maritime (the bar being created by the current of a sea) or fluvial (the bar being created by the flow of a bigger river at the confluence)."						"http://purl.obolibrary.org/obo/ENVO_00000453"
"lime mudstone"	"Lime mudstone is a limestone which is primarily composed of either clay-size or both silt-size and clay-size detrital (transported) carbonate grains."	"cementstone|calcilutite"					"http://purl.obolibrary.org/obo/ENVO_01000273"
"lime plaster"	"Lime plaster is a plaster which is primarily composed of calcium hydroxide and an inert filler (such as sand). Coversion of the calcium hydroxide to calcium carbonate through a reaction with carbon dioxide in the air causes the plaster to set."	"slaked lime plaster|lime stucco|lime render"					"http://purl.obolibrary.org/obo/ENVO_01000479"
"limed soil"	"Soil which has been amended with mineral additives to increase its pH."					"http://purl.obolibrary.org/obo/ENVO_03605015"	"http://purl.obolibrary.org/obo/ENVO_00005766"
"limestone"	"A sedimentary rock which is composed primarily of calcium carbonate in the form of calcite or aragnoite."						"http://purl.obolibrary.org/obo/ENVO_00002053"
"limestone cave"	"A cave formed in limestone, usually by dissolution of limestone by acidic groundwater."						"http://purl.obolibrary.org/obo/ENVO_01000359"
"limestone pavement"	"A natural karst landform consisting of a flat, incised surface of exposed limestone that resembles artificial pavement."						"http://purl.obolibrary.org/obo/ENVO_00000422"
"liquefied hydrocarbon gas"						"http://purl.obolibrary.org/obo/envo#envoPolar"	"http://purl.obolibrary.org/obo/ENVO_01000558"
"liquefied natural gas"	"Liquefied natural gas (LNG) is natural gas (predominantly methane, CH4) that has been converted to liquid form for ease of storage or transport. It takes up about 1/600th the volume of natural gas in the gaseous state. It is odorless, colorless, non-toxic and non-corrosive. LNG achieves a higher reduction in volume than compressed natural gas (CNG) so that the (volumetric) energy density of LNG is 2.4 times greater than that of CNG or 60 percent of that of diesel fuel."	"liquified natural gas|LNG"					"http://purl.obolibrary.org/obo/ENVO_01000557"
"liquefied petroleum gas"	"Liquified petroleum gas or liquid petroleum gas (LPG or LP gas), also referred to as simply propane or butane, are flammable mixtures of hydrocarbon gases used as fuel in heating appliances, cooking equipment, and vehicles."	"liquid petroleum gas|LPG|LP gas"			"liquified natural gas"		"http://purl.obolibrary.org/obo/ENVO_01000553"
"liquid accumulation process"	"A material accumulation process during which the volume of liquid entity increases."						"http://purl.obolibrary.org/obo/ENVO_01001856"
"liquid air-water interface layer"	"A liquid surface layer which is in contact with air."						"http://purl.obolibrary.org/obo/ENVO_01001309"
"liquid astronomical body part"	"A part of an astronomical body which is primarily composed of liquid material."						"http://purl.obolibrary.org/obo/ENVO_01001477"
"liquid environmental material"	"An environmental material which is in a liquid state."					"http://purl.obolibrary.org/obo/envo#envoPolar"	"http://purl.obolibrary.org/obo/ENVO_01000815"
"liquid layer"	"A layer which is primarily composed of some liquid material."						"http://purl.obolibrary.org/obo/ENVO_01001273"
"liquid planetary core"	"A liquid planetary core is a planetary core which is primarily composed of liquid material."						"http://purl.obolibrary.org/obo/ENVO_01000644"
"liquid planetary surface"					"A liquid planetary surface is a planetary surface layer where a liquid material of a planet comes into contact with atmosphere or outer space."		"http://purl.obolibrary.org/obo/ENVO_01000636"
"liquid surface layer"	"A surface layer which is composed primarily of some liquid."						"http://purl.obolibrary.org/obo/ENVO_01001310"
"liquid surface of an astronomical body"	"A surface of an astronomical body which is part of a water body present on that body."						"http://purl.obolibrary.org/obo/ENVO_01001783"
"liquid water"	"An environmental material primarily composed of dihydrogen oxide in its liquid form."		"water"			"http://purl.obolibrary.org/obo/ENVO_03605019"	"http://purl.obolibrary.org/obo/ENVO_00002006"
"listed building"	"A building that has been placed on one of the four statutory lists maintained by Historic England in England, Historic Environment Scotland in Scotland, Cadw in Wales, and the Northern Ireland Environment Agency in Northern Ireland."	"protected structure|listed structure"					"http://purl.obolibrary.org/obo/ENVO_03501273"
"lithia spring"	"A mineral spring through which water with elevated concentrations of lithium salts flows."						"http://purl.obolibrary.org/obo/ENVO_01001889"
"lithification"	"A process during which sediments compact under pressure, expel connate fluids, and gradually become solid sedimentary rock."						"http://purl.obolibrary.org/obo/ENVO_01001205"
"lithometeor"	"A meteor which is primarily composed of rock."					"http://purl.obolibrary.org/obo/envo#envoAtmo"	"http://purl.obolibrary.org/obo/ENVO_01001012"
"lithosphere"	"A lithosphere is the outermost shell of a terrestrial-type planet or natural satellite that is defined by its rigid mechanical properties."						"http://purl.obolibrary.org/obo/ENVO_01000646"
"litter"	"Environmental material consisting of waste products that have been discarded at an unsuitable location."						"http://purl.obolibrary.org/obo/ENVO_03501259"
"litter layer"		"ground layer"				"http://purl.obolibrary.org/obo/ENVO_03605023"	"http://purl.obolibrary.org/obo/ENVO_01000338"
"litter role"	"A role which 1) inheres in a material entity 2) is realised when that entity is discarded outside waste management systems by humans or their technologies."					"http://purl.obolibrary.org/obo/envo#envoPlastics"	"http://purl.obolibrary.org/obo/ENVO_06105109"
"littering"	"An anthropogenic environmental process during which waste is improperly disposed of into the environment."					"http://purl.obolibrary.org/obo/envo#envoPlastics"	"http://purl.obolibrary.org/obo/ENVO_06105108"
"littoral rainforest"	"A rainforest which 1) occurs near a marine coastline or littoral zone, 2) grows on beach sand, quartz-rich sediments, meta-sediments or on coastal headlands enriched by volcanic minerals, 3) is subject to aeolian transport of sea salt, including minerals such as calcium, magnesium, potassium and phosphorus."						"http://purl.obolibrary.org/obo/ENVO_01001953"
"littoral rainforest biome"	"A littoral rainforest which is in its climactic successional state."						"http://purl.obolibrary.org/obo/ENVO_01001960"
"littoral zone"	"An aquatic environment which is the part of a sea, lake, or river that is close to the shore."					"http://purl.obolibrary.org/obo/ENVO_03605025|http://purl.obolibrary.org/obo/ENVO_03605018"	"http://purl.obolibrary.org/obo/ENVO_01000407"
"live cave"	"A cave containing a stream or active speleothems."						"http://purl.obolibrary.org/obo/ENVO_00000323"
"livestock house"	"An animal house used for housing livestock."	"livestock structure|livestock shelter"					"http://purl.obolibrary.org/obo/ENVO_03501287"
"living room"	"A living room is a room in a human house which is used for social and domestic leisure activities."	"living-room"					"http://purl.obolibrary.org/obo/ENVO_01000423"
