?label	?subset	?definition	?URI
"Bondon cheese environment"	"http://purl.obolibrary.org/obo/envo#envoMeo"	"An environment which has its properties and composition determined by a portion of Bondon cheese."	"http://purl.obolibrary.org/obo/ENVO_01001180"
"freezing fog"	"http://purl.obolibrary.org/obo/envo#envoPolar"	"A fog the droplets of which freeze upon contact with exposed objects, forming a coating of rime or glaze."	"http://purl.obolibrary.org/obo/ENVO_03000137"
"desert biome"	"http://purl.obolibrary.org/obo/envo#wwfBiome"	"A desert ecosystem which is in its climactic successional state."	"http://purl.obolibrary.org/obo/ENVO_01000179"
"polluted lake"	"http://purl.obolibrary.org/obo/envo#environmental_hazards"	"A lake which has concentrations of environmental contaminants high enough to harm the ecosystems associated with it."	"http://purl.obolibrary.org/obo/ENVO_01000680"
"hair ice"	"http://purl.obolibrary.org/obo/envo#envoPolar"	"A type of water ice that forms on dead wood with the assistance of the fungus Exidiopsis effusa and takes the shape of fine, silky hair."	"http://purl.obolibrary.org/obo/ENVO_01000847"
"cumulus cloud"	"http://purl.obolibrary.org/obo/envo#envoCloudAtlas"	"A cloud which 1) has been shaped into rising mounds, domes, or towers with a bulging upper part resembling a cauliflower and a near horizontal or ragged base, 2) is mainly composed of water droplets, 3) is located in the low level of the atmosphere (low étage)."	"http://purl.obolibrary.org/obo/ENVO_01001414"
"snow patch"	"http://purl.obolibrary.org/obo/envo#envoPolar"	"An accumulation of snow and firn which rests upon land."	"http://purl.obolibrary.org/obo/ENVO_03000113"
"ocean acidification"	"http://purl.obolibrary.org/obo/envo#envoPolar"	"Ocean acidification is a process during which the pH of a sea or ocean is lowered."	"http://purl.obolibrary.org/obo/ENVO_01000631"
"snow water equivalent"	"http://purl.obolibrary.org/obo/envo#envoCryo"	"A depth which inheres in a layer of liquid water derived from the complete melting a mass of snow contained in an area."	"http://purl.obolibrary.org/obo/ENVO_03000142"
"oceanic mussel reef"	"http://purl.obolibrary.org/obo/envo#envoMarine"	"A marine reef which is present in the depths beyond (offshore relative to) the continental shelf and primarily composed of self-adhered or conglomerated mussel shells."	"http://purl.obolibrary.org/obo/ENVO_01001381"
"root"	"http://purl.obolibrary.org/obo/po#Gymnosperms"	"A plant axis (PO:0025004) that lacks shoot axis nodes (PO:0005004) and usually grows indeterminately."	"http://purl.obolibrary.org/obo/PO_0009005"
"cirrocumulus castellanus cloud"	"http://purl.obolibrary.org/obo/envo#envoAtmo"	"A cirrocumulus cloud which 1) has linearly arranged cumuliform protuberances which resemble crenellated turrets or towers, some of which are taller than they are wide in some portion of their upper parts, 2) possess a lower region or base which connects these protuberances."	"http://purl.obolibrary.org/obo/ENVO_01001426"
"glacial lake"	"http://purl.obolibrary.org/obo/envo#envoPolar"	"A lake which is primarily composed of glacial meltwater and which fills a depression formed as a result of a glacial erosion process."	"http://purl.obolibrary.org/obo/ENVO_00000488"
"aerobic respiration, using ammonia as electron donor"	"envoPolar"		"http://purl.obolibrary.org/obo/GO_0019409"
"blizzard"	"http://purl.obolibrary.org/obo/envo#envoCryo"	"A blizzard is a severe snowstorm during which snowfall is transported by strong winds, sustained for several hours."	"http://purl.obolibrary.org/obo/ENVO_01000903"
"subtropical shrubland biome"	"http://purl.obolibrary.org/obo/envo#wwfBiome"	"A shrubland biome which is subject to subtropical climate patterns."	"http://purl.obolibrary.org/obo/ENVO_01000213"
"sleet pellet"	"http://purl.obolibrary.org/obo/envo#envoPolar"	"An ice mass which is primarily composed of frozen or mostly frozen raindrops or refrozen partially melted snowflakes."	"http://purl.obolibrary.org/obo/ENVO_03400015"
"sea cliff"	"http://purl.obolibrary.org/obo/envo#envoPolar"	"A cliff that is a margin of a sea or ocean."	"http://purl.obolibrary.org/obo/ENVO_00000088"
"drainage wind"	"http://purl.obolibrary.org/obo/envo#envoAtmo"	"A downslope katabatic wind which is generated by the cooling of atmospheric gas in contact with terrain surfaces."	"http://purl.obolibrary.org/obo/ENVO_01001744"
"sea"	"http://purl.obolibrary.org/obo/envo#envoPolar"	"A lentic water body which is wholly or partly surrounded by land and either connected to or derived from a part of an ocean."	"http://purl.obolibrary.org/obo/ENVO_00000016"
"terminal moraine"	"http://purl.obolibrary.org/obo/envo#envoPolar"	"Ridges of unconsolidated debris deposited at the snout or end of the glacier. They usually reflect the shape of the glacier's terminus."	"http://purl.obolibrary.org/obo/ENVO_00000252"
"coastal inlet"	"http://purl.obolibrary.org/obo/envo#envoPolar"	"An opening of the sea into the land."	"http://purl.obolibrary.org/obo/ENVO_00000137"
"estuarine coastal surface layer"	"http://purl.obolibrary.org/obo/envo#envoCmecs"	"A layer of estuarine water which extends a few centimeters from the surface of the water column towards the estuary bed and from the shore to a fiat boundary where the estuary bed below the water column reaches a depth of 4 meters."	"http://purl.obolibrary.org/obo/ENVO_01001302"
"environment determined by a metazoan secretion"	"http://purl.obolibrary.org/obo/envo#envoOmics"	"An environmental system which has its properties and dynamics determined by a bodily secretion of a metazoan."	"http://purl.obolibrary.org/obo/ENVO_01001030"
"migration path"	"http://purl.obolibrary.org/obo/envo#envoPolar"	"An ecological corridor through which organisms move during a migration process."	"http://purl.obolibrary.org/obo/ENVO_01000931"
"fishing gear"	"http://purl.obolibrary.org/obo/envo#envoPlastics"	"A manufactured product which is used for fishing."	"http://purl.obolibrary.org/obo/ENVO_06105115"
"cryosphere"	"http://purl.obolibrary.org/obo/envo#envoPolar"	"An astronomical body part which is composed primarily of environmental materials in their frozen form."	"http://purl.obolibrary.org/obo/ENVO_03000143"
"animal trap"	"http://purl.obolibrary.org/obo/envo#envoCesab"	"A manufactured product which is designed to catch and hold animals."	"http://purl.obolibrary.org/obo/ENVO_01000975"
"aerosol environment"	"http://purl.obolibrary.org/obo/envo#envoOmics"	"An environmental system which has its properties and dynamics determined by an aerosol."	"http://purl.obolibrary.org/obo/ENVO_01001052"
"face skin environment"	"http://purl.obolibrary.org/obo/envo#envoMeo"		"http://purl.obolibrary.org/obo/ENVO_2100005"
"cryopeg"	"http://purl.obolibrary.org/obo/envo#envoNceas"	"A layer which is composed of ground that 1) remains unfrozen due to increased solute concentration and 2) is present within a mass of permafrost."	"http://purl.obolibrary.org/obo/ENVO_01001559"
"plant organ"	"http://purl.obolibrary.org/obo/po#TraitNet"	"A multi-tissue plant structure (PO:0025496) that is a functional unit, is a proper part of a whole plant (PO:0000003), and includes portions of plant tissue (PO:0009007) of at least two different types that derive from a common developmental path."	"http://purl.obolibrary.org/obo/PO_0009008"
"blue ice"	"http://purl.obolibrary.org/obo/envo#envoPolar"	"Water ice containing little to no air bubbles resulting in a reduction of internal light scattering and, given sufficient volume, a blue appearance."	"http://purl.obolibrary.org/obo/ENVO_03000007"
"hydrothermal vent"	"http://purl.obolibrary.org/obo/envo#EnvO-Lite-GSC"	"A fissure in the Earths's surface from which geothermally heated water issues."	"http://purl.obolibrary.org/obo/ENVO_00000215"
"storm surge process"	"http://purl.obolibrary.org/obo/envo#environmental_hazards"	"A storm surge process is a coastal flooding process which is caused by low pressure weather systems such as tropical cyclones and strong extratropical cyclones, the severity of which is affected by the shallowness and orientation of the water body relative to storm path, and the timing of tides."	"http://purl.obolibrary.org/obo/ENVO_01000716"
"plateau glacier"	"http://purl.obolibrary.org/obo/envo#envoPolar"	"A glacier on a plateau or high area, smaller than an ice sheet."	"http://purl.obolibrary.org/obo/ENVO_00000457"
"neritic mussel bed"	"http://purl.obolibrary.org/obo/envo#envoCmecs"	"A mussel bed which is located in benthic regions that are part of a continental shelf."	"http://purl.obolibrary.org/obo/ENVO_01001389"
"soil surface layer"	"http://purl.obolibrary.org/obo/envo#envoNceas"	"A surface layer which is composed primarily of soil."	"http://purl.obolibrary.org/obo/ENVO_04000010"
"astronomical body part"	"http://purl.obolibrary.org/obo/envo#envoPolar"	"A material part of an astronomical body."	"http://purl.obolibrary.org/obo/ENVO_01000813"
"snowstorm"	"http://purl.obolibrary.org/obo/envo#environmental_hazards"	"An atmospheric storm during which intense snowfall occurs."	"http://purl.obolibrary.org/obo/ENVO_01000881"
"ice fog"	"http://purl.obolibrary.org/obo/envo#envoPolar"	"Fog which is composed of particles of ice."	"http://purl.obolibrary.org/obo/ENVO_03000139"
"radio wave stellar radiation"	"http://purl.obolibrary.org/obo/envo#envoAstro"	"A stellar radiation process during which electromagnetic waves or their quanta are emitted from a star at wavelengths ranging from millimetre to kilometer scales."	"http://purl.obolibrary.org/obo/ENVO_01001213"
"feather environment"	"http://purl.obolibrary.org/obo/envo#envoMeo"		"http://purl.obolibrary.org/obo/ENVO_2100006"
"depositional process"	"http://purl.obolibrary.org/obo/envo#envoPolar"	"A process during which material entities are added to a landform or to a feature upon the landform."	"http://purl.obolibrary.org/obo/ENVO_03000054"
"gas planet"	"http://purl.obolibrary.org/obo/envo#envoAstro"	"A planet which is primarily composed of hydrogen and helium."	"http://purl.obolibrary.org/obo/ENVO_01001122"
"ice calving process"	"http://purl.obolibrary.org/obo/envo#envoPolar"	"A process during which a part of an ice mass breaks away from the main mass."	"http://purl.obolibrary.org/obo/ENVO_01000917"
"snow layer"	"http://purl.obolibrary.org/obo/envo#envoPolar"	"A cryospheric layer which is primarily composed of snow."	"http://purl.obolibrary.org/obo/ENVO_03000141"
"proglacial lake"	"http://purl.obolibrary.org/obo/envo#envoPolar"	"A lake formed either by the damming action of a moraine or ice dam during the retreat of a melting glacier, or one formed by meltwater trapped against an ice mass due to isostatic depression of the crust around the ice."	"http://purl.obolibrary.org/obo/ENVO_00000435"
"biogeochemical cycling"	"http://purl.obolibrary.org/obo/envo#envoPolar"	"A biogeochemical process during which one or more chemical compounds are sequentially converted into a series of related compounds in a regularly repeating, periodic fashion."	"http://purl.obolibrary.org/obo/ENVO_02500009"
"saline environment"	"http://purl.obolibrary.org/obo/envo#envoEmpo"	"An environment which is determined by materials which bear significant concentrations of salts."	"http://purl.obolibrary.org/obo/ENVO_01001040"
"saline water environment"	"http://purl.obolibrary.org/obo/envo#envoPolar"	"An environmental system which has its properties and dynamics determined by saline water."	"http://purl.obolibrary.org/obo/ENVO_01000307"
"star"	"http://purl.obolibrary.org/obo/envo#envoAstro"	"An astronomical object which is composed primarily of luminous plasma held in a spherical form by gravitational forces."	"http://purl.obolibrary.org/obo/ENVO_01000801"
"area of woody wetland"	"http://purl.obolibrary.org/obo/envo#nlcd2011"	"An area of a planet's surface which is partly covered by forest or shrubland vegetation and where the underlying soil or substrate is periodically saturated with or covered by water. This area is in contact with an atmospheric column extending from the planetary boundary layer to the planet's exosphere with little to no physical obstruction."	"http://purl.obolibrary.org/obo/ENVO_01000893"
"thaw hole"	"http://purl.obolibrary.org/obo/envo#envoPolar"	"A channel which traverses an ice mass floating on a water body and bridges the atmosphere to the underlying water through its internal cavity."	"http://purl.obolibrary.org/obo/ENVO_03000048"
"snowpack"	"http://purl.obolibrary.org/obo/envo#envoCryo"	"A snow mass which is large enough, and persists long enough, to undergo compaction under its own weight, leading to layer-like structural differentiation."	"http://purl.obolibrary.org/obo/ENVO_03000116"
"wildfire"	"http://purl.obolibrary.org/obo/envo#environmental_hazards"	"A conflagration which is uncontrolled and combusts material in a vegetated area, be it rural or wild."	"http://purl.obolibrary.org/obo/ENVO_01000787"
"artificial harbor"	"http://purl.obolibrary.org/obo/envo#envoPolar"	"A harbor constructed by human agency."	"http://purl.obolibrary.org/obo/ENVO_00000464"
"pancake ice"	"http://purl.obolibrary.org/obo/envo#envoPolar"	"A sea ice floe which has a rounded or circular shape and raised rims."	"http://purl.obolibrary.org/obo/ENVO_03000067"
"portion of meristem tissue"	"http://purl.obolibrary.org/obo/po#TraitNet"	"A portion of plant tissue (PO:0009007) in which plant cells (PO:0009002) have retained their embryonic characteristics, or have reverted to them secondarily, and that divide to produce new cells that can undergo differentiation to form mature tissues, i.e. they have a capacity for morphogenesis and growth."	"http://purl.obolibrary.org/obo/PO_0009013"
"nanoplastic particle"	"http://purl.obolibrary.org/obo/envo#envoPlastics"	"A piece of plastic which has a diameter less than 1 micrometre."	"http://purl.obolibrary.org/obo/ENVO_06105105"
"environmental system determined by an organism"	"http://purl.obolibrary.org/obo/envo#envoOmics"	"An environmental system which is determined by a living organism."	"http://purl.obolibrary.org/obo/ENVO_01001000"
"nimbostratus cloud"	"http://purl.obolibrary.org/obo/envo#envoAtmo"	"A cloud which 1) occurs in the form of a layer, 2) is composed of water droplets (sometimes supercooled) and raindrops, or snow crystals and snowflakes, or of a mixture of these liquid and solid particles, 3) is located in the middle level of the atmosphere (middle étage)."	"http://purl.obolibrary.org/obo/ENVO_01001411"
"lithometeor"	"http://purl.obolibrary.org/obo/envo#envoAtmo"	"A meteor which is primarily composed of rock."	"http://purl.obolibrary.org/obo/ENVO_01001012"
"dioxygen dissolved in marine water"	"http://purl.obolibrary.org/obo/envo#envoMarine"	"Dioxygen which is the solute in a solution with ocean water as its solvent."	"http://purl.obolibrary.org/obo/ENVO_01001495"
"volatile astrogeological material"	"http://purl.obolibrary.org/obo/envo#envoAstro"	"A material which is composed primarily of chemical elements and compounds with relatively low boiling points, equilibrium condensation temperatures below 1300 Kelvin, and which are part of the crust or atmosphere of a moon or planet."	"http://purl.obolibrary.org/obo/ENVO_01001154"
"sludge"	"http://purl.obolibrary.org/obo/envo#EnvO-Lite-GSC"	"The residual semi-solid material left from domestic or industrial processes, or wastewater treatment processes."	"http://purl.obolibrary.org/obo/ENVO_00002044"
"active permafrost layer"	"http://purl.obolibrary.org/obo/envo#envoNceas"	"A layer which is composed of ground that is 1) subject to annual thawing and freezing and 2) present in areas underlain by permafrost."	"http://purl.obolibrary.org/obo/ENVO_04000009"
"manganese-reducing sediment"	"http://purl.obolibrary.org/obo/envo#envoPolar"	"Sediment hosting and characterised by active manganese reducing microbial communities."	"http://purl.obolibrary.org/obo/ENVO_01000151"
"lateral moraine"	"http://purl.obolibrary.org/obo/envo#envoPolar"	"The parallel ridges of till deposited along the sides of an alglacier. The unconsolidated debris is deposited on top of the glacier by frost shattering of the valley walls and from tributary streams flowing into the valley. The till is carried along the glacial margin until the glacier melts."	"http://purl.obolibrary.org/obo/ENVO_00000249"
"shoot apical meristem"	"http://purl.obolibrary.org/obo/po#TraitNet"	"A shoot system meristem (PO:0006079) formed at the apex of the shoot axis (PO:0025029), including those originating from an axillary bud meristem (PO:0000232)."	"http://purl.obolibrary.org/obo/PO_0020148"
"cirrus fibratus cloud"	"http://purl.obolibrary.org/obo/envo#envoAtmo"	"A cirrus cloud which occurs as a detached unit or a thin veil and consists of nearly straight or irregularly curved filaments that do not terminate in hooks or tufts."	"http://purl.obolibrary.org/obo/ENVO_01001418"
"cold environment"	"http://purl.obolibrary.org/obo/envo#envoPolar"	"An environment which has a lower temperature than some local or global average."	"http://purl.obolibrary.org/obo/ENVO_01000309"
"storm"	"http://purl.obolibrary.org/obo/envo#environmental_hazards"	"A storm is an environmental process in which an environmental system and the processes it participates in are strongly perturbed by external forcings. These forcings typically increase the rates of processes unfolding in the system, relative to their normal rates."	"http://purl.obolibrary.org/obo/ENVO_01000876"
"marine water mass"	"http://purl.obolibrary.org/obo/envo#envoPolar"	"A mass of marine water."	"http://purl.obolibrary.org/obo/ENVO_01000686"
"ice cap"	"http://purl.obolibrary.org/obo/envo#envoPolar"	"A dome-shaped ice mass that covers less than 50,000 km2 of land area (usually covering a highland area)."	"http://purl.obolibrary.org/obo/ENVO_00000145"
"montane"	"http://purl.obolibrary.org/obo/envo#envoPolar"	"An altitudinal condition which inheres in a bearer by virtue of the bearer being located at an altitude between mid-altitude forests and the tree line."	"http://purl.obolibrary.org/obo/ENVO_01000342"
"periglacial lake"	"http://purl.obolibrary.org/obo/envo#envoPolar"	"A lake, part of whose margin is formed by an ice mass, ice cap or glacier, the ice having obstructed the natural drainage of the land."	"http://purl.obolibrary.org/obo/ENVO_00000200"
"water ice sublimation process"	"http://purl.obolibrary.org/obo/envo#envoPolar"	"A sublimation process during which water ice transitions into a gaseous state."	"http://purl.obolibrary.org/obo/ENVO_01000920"
"frazil ice"	"http://purl.obolibrary.org/obo/envo#envoPolar"	"New ice which is composed frazil which has congealed into a thin sheet."	"http://purl.obolibrary.org/obo/ENVO_03000046"
"nivation"	"http://purl.obolibrary.org/obo/envo#envoPolar"	"A material transformation process during which recently precipitated, powdery snow transitions into firn or névé through compaction and/or through cycles of freezing and thawing."	"http://purl.obolibrary.org/obo/ENVO_03000003"
"marine tidal flow zone"	"http://purl.obolibrary.org/obo/envo#envoMarine"	"An environmental zone in which varying gravitational forces from astronomical bodies, combined with the rotation of the astronomical body containing the zone, cause marine waters to undergo periodic depth oscillations (tides)."	"http://purl.obolibrary.org/obo/ENVO_01001341"
"formation of a solid aerosol in an atmosphere"	"http://purl.obolibrary.org/obo/envo#envoAtmo"	"A process during which an aerosol, consisting of solid particulates suspended in a gas, is formed in an atmosphere."	"http://purl.obolibrary.org/obo/ENVO_01001086"
"pitfall trap"	"http://purl.obolibrary.org/obo/envo#envoCesab"	"An animal trap which consists of a container set flush with the ground such that animals moving along the ground may fall in and be available for examination or collection."	"http://purl.obolibrary.org/obo/ENVO_01000976"
"glacial valley"	"http://purl.obolibrary.org/obo/envo#envoPolar"	"A valley that contains, or contained, a glacier and was formed by glacial activity. Typically U-shaped in cross-section."	"http://purl.obolibrary.org/obo/ENVO_00000248"
"root"	"http://purl.obolibrary.org/obo/po#Tomato"	"A plant axis (PO:0025004) that lacks shoot axis nodes (PO:0005004) and usually grows indeterminately."	"http://purl.obolibrary.org/obo/PO_0009005"
"atmospheric layer"	"http://purl.obolibrary.org/obo/envo#envoPolar"	"A layer that is part of the atmosphere."	"http://purl.obolibrary.org/obo/ENVO_01000543"
"semi-diurnal marine tidal flow zone"	"http://purl.obolibrary.org/obo/envo#envoMarine"	"A marine tidal flow zone in which ocean waters undergo a semi-diurnal (twice per day) tidal oscillation - with two high and two low tides per day of roughly equal amplitude."	"http://purl.obolibrary.org/obo/ENVO_01001340"
"dry-adiabatic process"	"http://purl.obolibrary.org/obo/envo#envoAtmo"	"An adiabatic process during which no condensation of water vapor occurs and no liquid water is present."	"http://purl.obolibrary.org/obo/ENVO_01001724"
"lava flow"	"http://purl.obolibrary.org/obo/envo#environmental_hazards"	"A lava flow is a moving outpouring of lava, which is created during a non-explosive effusive eruption."	"http://purl.obolibrary.org/obo/ENVO_01000438"
"fragmentation due to weathering"	"http://purl.obolibrary.org/obo/envo#envoPlastics"	"A fragmentation process which is caused by weathering."	"http://purl.obolibrary.org/obo/ENVO_06105028"
"ocean basin"	"http://purl.obolibrary.org/obo/envo#envoPolar"	"A structural basin that is below sea level."	"http://purl.obolibrary.org/obo/ENVO_00002450"
"hydrodynamic escape"	"http://purl.obolibrary.org/obo/envo#envoAstro"	"An atmospheric escape process during which atoms that are parts of a planetary atmosphere escape into outer space through numerous collisions with lighter atoms in that atmosphere."	"http://purl.obolibrary.org/obo/ENVO_01001158"
"second year ice formation"	"http://purl.obolibrary.org/obo/envo#envoPolar"	"A sea ice formation process during which seawater freezes onto first year ice during the cold season, forming second year sea ice."	"http://purl.obolibrary.org/obo/ENVO_03000061"
"freshwater biome"	"http://purl.obolibrary.org/obo/envo#envoPolar"	"An freshwater ecosystem which is in its climactic successional state."	"http://purl.obolibrary.org/obo/ENVO_00000873"
"Bathymodiolus-dominated oceanic mussel reef"	"http://purl.obolibrary.org/obo/envo#envoCmecs"	"An oceanic mussel reef which is primarily settled by mussels of the genus Bathymodiolus and primarily composed of self-adhered or conglomerated mussel shells"	"http://purl.obolibrary.org/obo/ENVO_01001385"
"mountain range"	"http://purl.obolibrary.org/obo/envo#envoPolar"	"A range of mounts which is dominated by mountains."	"http://purl.obolibrary.org/obo/ENVO_00000080"
"cooling-driven katabatic wind"	"http://purl.obolibrary.org/obo/envo#envoAtmo"	"A katabatic wind which is driven by the cooling and subsequent sinking of atmospheric gas masses."	"http://purl.obolibrary.org/obo/ENVO_01001721"
"shoot axis"	"http://purl.obolibrary.org/obo/po#Arabidopsis"	"A plant axis (PO:0025004) that is part of a shoot system (PO:0009006)."	"http://purl.obolibrary.org/obo/PO_0025029"
"cirque glacier"	"http://purl.obolibrary.org/obo/envo#envoPolar"	"A small glacier contained within a cirque basin."	"http://purl.obolibrary.org/obo/ENVO_03000013"
"area of lichen-dominated vegetation"	"http://purl.obolibrary.org/obo/envo#nlcd2011"	"An area of a planet's surface which is primarily covered by fruticose or foliose lichens and which is in contact with an atmospheric column extending from the planetary boundary layer to the planet's exosphere with little to no physical obstruction."	"http://purl.obolibrary.org/obo/ENVO_01000889"
"marine pelagic biome"	"http://purl.obolibrary.org/obo/envo#envoPolar"	"The marine pelagic biome (pelagic meaning open sea) is that of the marine water column, from the surface to the greatest depths."	"http://purl.obolibrary.org/obo/ENVO_01000023"
"snow cover"	"http://purl.obolibrary.org/obo/envo#envoCryo"	"An area density which inheres in snow distributed over an area of a landmass or other substrate."	"http://purl.obolibrary.org/obo/ENVO_03400003"
"ice pellet"	"http://purl.obolibrary.org/obo/envo#envoCryo"	"An ice mass which is 1) transparent or translucent, 2) rounded, spherically, or cylindrically shaped, and 3) less than 5 milimetres in diameter."	"http://purl.obolibrary.org/obo/ENVO_03400005"
"ecosystem-wide photosynthesis"	"http://purl.obolibrary.org/obo/envo#envoPolar"	"A process which consists of all photosynthesis processes instantiated in an ecosystem."	"http://purl.obolibrary.org/obo/ENVO_02500007"
"carbon dioxide ice"	"http://purl.obolibrary.org/obo/envo#envoAstro"	"Ice which is primarily composed of carbon dioxide."	"http://purl.obolibrary.org/obo/ENVO_01001138"
"biogenous sediment"	"http://purl.obolibrary.org/obo/envo#envoPolar"	"Biogenous sediment is derived from living organisms, typically planktonic organisms possessing shells, frustules or coccoliths."	"http://purl.obolibrary.org/obo/ENVO_01000082"
"greenhouse effect"	"http://purl.obolibrary.org/obo/envo#envoPolar"	"A process by which thermal radiation from a planetary surface is absorbed by atmospheric greenhouse gases, and is re-radiated in all directions. Since part of this re-radiation is back towards the surface and the lower atmosphere, it results in an elevation of the average surface temperature above what it would be in the absence of the gases."	"http://purl.obolibrary.org/obo/ENVO_02500004"
"field"	"http://purl.obolibrary.org/obo/envo#envoPolar"	"An unbroken expanse (as of ice)"	"http://purl.obolibrary.org/obo/ENVO_01000352"
"polynya"	"http://purl.obolibrary.org/obo/envo#envoCryo"	"A sea surface layer which is 1) not covered by ice and 2) laterally surrounded by either pack ice or land and pack ice."	"http://purl.obolibrary.org/obo/ENVO_00000484"
