ID	label	subClassOf [ID]	subClassOf [LABEL]	SYNONYMS	inSubset	definition
ENVO:00002982	clay	ENVO:00010483	environmental material			A group of hydrous aluminium phyllosilicate (phyllosilicates being a subgroup of silicate minerals) minerals (see clay minerals), that are typically less than 2 micrometres in diameter. Clay consists of a variety of phyllosilicate minerals rich in silicon and aluminium oxides and hydroxides which include variable amounts of structural water.
ENVO:00002983	fuel oil	ENVO:00002985	oil	furnace oil|heavy oil|marine fuel		An oil which 1) is liquid at room temperature (approximately 20 degrees Celsius) 2) is intended to be burned in a furnace or boiler for the generation of heat or used in an engine for the generation of power, 3) is obtained from petroleum distillation, either as a distillate or a residue, 4) composed of long hydrocarbon chains, particularly alkanes, cycloalkanes and aromatics.
ENVO:00002984	petroleum	ENVO:00002985	oil	crude oil		A naturally occurring flammable liquid consisting of a complex mixture of hydrocarbons of various molecular weights and other liquid organic compounds, that are found in geologic formations beneath the planetary surfaces.
ENVO:00002985	oil	ENVO:01000815|ENVO:2000045	hydrocarbon-based environmental material|liquid environmental material			A nonpolar, hydrophobic, and lipophilic material which is a viscous liquid at ambient temperatures (about 20 degrees Celsius) or slightly warmer.
ENVO:00003030	silage	ENVO:0010003	agricultural environmental material			A fermented, high-moisture forage that can be fed to ruminants.
ENVO:00003031	animal manure	ENVO:00010483	environmental material			
ENVO:00003032	fresh animal manure	ENVO:00003031	animal manure			
ENVO:00003033	mushroom compost	ENVO:00002170	compost			A compost which generally consists of a combination of wheat straw, dried blood, horse manure and ground chalk, composted together and is the residual compost waste generated by industrial mushroom production.
ENVO:00003044	brine	ENVO:00002012	hypersaline water		envoPolar	Water saturated or nearly saturated with salt (NaCl).
ENVO:00003045	bacon curing brine	ENVO:00003044	brine			
ENVO:00003064	drinking water	ENVO:00002011	fresh water	potable water		Drinking water is water which may be consumed by humans with no adverse effects on their health.
ENVO:00003065	distilled water	ENVO:00002006	liquid water			
ENVO:00003071	grass silage	ENVO:00003030	silage			
ENVO:00003076	glue	ENVO:0010001	anthropogenic environmental material	adhesive|mucilage|paste		Glue is any substance applied to the surfaces of materials that binds them together and resists separation.
ENVO:00003081	metal contaminated soil	ENVO:00002116	contaminated soil			Soil which has elevated concentrations of metals.
ENVO:00003082	enriched soil	ENVO:00001998	soil			A portion of enriched soil is a portion of soil with elevated levels of some material entity.
ENVO:00003083	sarcosine enriched soil	ENVO:00003082	enriched soil			A portion of sarcosine enriched soil is a portion of soil with elevated levels of sarcosine.
ENVO:00003084	trimethylamine enriched soil	ENVO:00003082	enriched soil			A portion of trimethylamine enriched soil is a portion of soil with elevated levels of trimethylamine.
ENVO:00003085	skatole enriched soil	ENVO:00003082	enriched soil			A portion of skatole enriched soil is a portion of soil with elevated levels of skatole.
ENVO:00003086	ethanol enriched soil	ENVO:00003082	enriched soil			A portion of ethanol enriched soil is a portion of soil with elevated levels of ethanol.
ENVO:00003087	acetamide enriched soil	ENVO:00003082	enriched soil			A portion of acetamide enriched soil is a portion of soil with elevated levels of acetamide.
ENVO:00003088	pantothenate enriched soil	ENVO:00003082	enriched soil			A portion of pantothenate enriched soil is a portion of soil with elevated levels of pantothenate.
ENVO:00003089	testosterone enriched soil	ENVO:00003082	enriched soil			A portion of testosterone enriched soil is a portion of soil with elevated levels of testosterone.
ENVO:00003090	kynurenate enriched soil	ENVO:00003082	enriched soil			A portion of kynurenate enriched soil is a portion of soil with elevated levels of kynurenate.
ENVO:00003091	threonine enriched soil	ENVO:00003082	enriched soil			A portion of threonine enriched soil is a portion of soil with elevated levels of threonine.
ENVO:00003092	salicylate enriched soil	ENVO:00003082	enriched soil			A portion of salicylate enriched soil is a portion of soil with elevated levels of salicylate.
ENVO:00003093	poly-beta-hydroxybutyrate enriched soil	ENVO:00003082	enriched soil			A portion of poly-beta-hydroxybutyrate enriched soil is a portion of soil with elevated levels of poly-beta-hydroxybutyrate.
ENVO:00003094	L-(+)-tartrate enriched soil	ENVO:00003082	enriched soil			A portion of L-(+)-tartrate enriched soil is a portion of soil with elevated levels of L-(+)-tartrate.
ENVO:00003095	quinate enriched soil	ENVO:00003082	enriched soil			A portion of quinate enriched soil is a portion of soil with elevated levels of quinate.
ENVO:00003096	tap water	ENVO:00002011	fresh water			
ENVO:00003097	bore hole water	ENVO:00002006	liquid water			
ENVO:00003859	horse manure	ENVO:00003031	animal manure			
ENVO:00003860	pig manure	ENVO:00003031	animal manure			Manure which is primarily composed of pig feces.
ENVO:00003869	straw	ENVO:0010003	agricultural environmental material			An agricultural byproduct, the dry stalk of a cereal plant, after the nutrient grain or seed has been removed.
ENVO:00003870	rice straw	ENVO:00003869	straw			
ENVO:00003884	farmyard manure	ENVO:00003031	animal manure			
ENVO:00003900	rye grass silage	ENVO:00003071	grass silage			
ENVO:00003903	aviation fuel	ENVO:00002985	oil	jet fuel		
ENVO:00003908	poultry deep litter	ENVO:00002192	poultry litter			
ENVO:00003914	chalk soil	ENVO:00003082	enriched soil			
ENVO:00003927	stable manure	ENVO:00003031	animal manure			
ENVO:00003930	scum	ENVO:00010483	environmental material			A layer of impurities that accumulates at the surface of a liquid (especially water or molten metal).
ENVO:00003965	anaerobic digester sludge	ENVO:00002129	anaerobic sludge			
ENVO:00003978	potato silage	ENVO:00003030	silage			
ENVO:00003982	travertine	ENVO:00002053	limestone			A natural chemical precipitate of carbonate minerals; typically aragonite, but often recrystallized to or primarily calcite; which is deposited from the water of mineral springs (especially hot springs) or streams saturated with calcium carbonate.
ENVO:00005738	foam	ENVO:00010483	environmental material			
ENVO:00005739	sea foam	ENVO:00005738	foam			
ENVO:00005740	paddy field soil	ENVO:00002259	agricultural soil	rice paddy soil		
ENVO:00005741	alpine soil	ENVO:00001998	soil		envoPolar	
ENVO:00005742	arable soil	ENVO:00001998	soil		envoMeo	
ENVO:00005743	roadside soil	ENVO:00001998	soil			A portion of soil which is found in a roadside area.
ENVO:00005744	allotment garden soil	ENVO:00002263	garden soil			Soil which is part of an allotment garden.
ENVO:00005746	savanna soil	ENVO:00005750	grassland soil			A portion of soil which is found in a savanna.
ENVO:00005747	compost soil	ENVO:00001998	soil			
ENVO:00005748	dry soil	ENVO:00001998	soil			Soil which has little to no water content and in which minerals and other soluble chemical entities have either bonded or become adsorbed to sold particles due to insufficient water availability.
ENVO:00005749	farm soil	ENVO:00001998	soil			A portion of soil which is part of a cropland or a rangeland biome.
ENVO:00005750	grassland soil	ENVO:00001998	soil			A portion of soil which is found in a grassland.
ENVO:00005751	jungle soil	ENVO:00001998	soil			Soil which is part of a densely forested area subject to tropical climate patterns.
ENVO:00005752	sawah soil	ENVO:00001998	soil			
ENVO:00005753	urea enriched soil	ENVO:00003082	enriched soil			A portion of urea enriched soil is a portion of soil with elevated levels of urea.
ENVO:00005754	fertilized soil	ENVO:00001998	soil			
ENVO:00005755	field soil	ENVO:00001998	soil			
ENVO:00005756	lawn soil	ENVO:00001998	soil			
ENVO:00005757	bacteria enriched soil	ENVO:00003082	enriched soil			A portion of bacteria enriched soil is a portion of soil with elevated bacterial abundance.
ENVO:00005758	alluvial swamp soil	ENVO:00002871	alluvial soil			A portion of alluvial soil which is part of a swamp ecosystem.
ENVO:00005759	alluvial paddy field soil	ENVO:00002871|ENVO:00005740	alluvial soil|paddy field soil			
ENVO:00005760	burned soil	ENVO:00001998	soil	burnt soil		
ENVO:00005761	meadow soil	ENVO:00001998	soil			
ENVO:00005762	chloropicrin enriched soil	ENVO:00003082	enriched soil			A portion of chloropicrin enriched soil is a portion of soil with elevated levels of chloropicrin.
ENVO:00005763	humus-rich acidic ash soil	ENVO:00003082	enriched soil			
ENVO:00005764	pond soil	ENVO:00001998	soil			
ENVO:00005765	frozen compost soil	ENVO:00005747|ENVO:01001526	compost soil|frozen soil			
ENVO:00005766	limed soil	ENVO:00001998	soil			
ENVO:00005767	manured soil	ENVO:00001998	soil			Soil which has, as a part, a portion of either fresh or processed animal manure.
ENVO:00005768	orchid soil	ENVO:00001998	soil			Soil which has properties to which plants in the Family Orchidaceae have adapted, including increased levels of aeration and drainage.
ENVO:00005769	mountain forest soil	ENVO:00002261	forest soil			
ENVO:00005770	beech forest soil	ENVO:00002261	forest soil			
ENVO:00005771	muddy soil	ENVO:00001998	soil			Soil which is composed of a large proportion of mud, thus having properties resembling mud.
ENVO:00005772	orchard soil	ENVO:00005749	farm soil			Soil in which trees from an orchard grow.
ENVO:00005773	pasture soil	ENVO:00001998	soil			Soil which is found in a pasture and in which vegetation, such as the grass used for the grazing of ungulates, grows.
ENVO:00005774	peat soil	ENVO:00001998	soil	peat		
ENVO:00005775	salt contaminated soil	ENVO:00002116	contaminated soil	salty soil		Soil which has elevated concentrations of sodium chloride.
ENVO:00005776	peaty paddy field soil	ENVO:00005740	paddy field soil			
ENVO:00005777	steppe soil	ENVO:00005750	grassland soil			A portion of soil which is found in a steppe.
ENVO:00005778	tropical soil	ENVO:00001998	soil			
ENVO:00005779	vegetable garden soil	ENVO:00002263	garden soil			
ENVO:00005780	greenhouse soil	ENVO:00001998	soil			A portion of soil which is found in a greenhouse.
ENVO:00005781	heat stressed soil	ENVO:00001998	soil			
ENVO:00005782	ornithogenic soil	ENVO:00001998	soil			Soil which is formed from avian fecal matter.
ENVO:00005783	leafy wood soil	ENVO:00002261	forest soil			
ENVO:00005784	spruce forest soil	ENVO:00002261	forest soil			
ENVO:00005786	upland soil	ENVO:00001998	soil			
ENVO:00005787	eucalyptus forest soil	ENVO:00002261	forest soil			
ENVO:00005788	rubber plantation soil	ENVO:00002259	agricultural soil			
ENVO:00005789	bluegrass field soil	ENVO:00002259	agricultural soil			Bluegrass field soil is a soil which is found in a field of Kentucky Bluegrass (Poa pratensis).
ENVO:00005790	red soil	ENVO:00001998	soil			
ENVO:00005791	sterile water	ENVO:00002006	liquid water			Sterile water is water which does not contain lliving organisms.
ENVO:00005792	underground water	ENVO:00002006	liquid water	subterranean water	envoPolar	Water which has physicochemical properties determined by processes which occur beneath the planetary crust.
ENVO:00005793	muddy water	ENVO:00002006	liquid water			
ENVO:00005794	water scum	ENVO:00003930	scum			
ENVO:00005795	marine mud	ENVO:01000001	mud		envoPolar	Mud which is part of a marine ecosystem.
ENVO:00005796	marine sludge	ENVO:00002044	sludge			
ENVO:00005797	lake bottom mud	ENVO:01000001	mud			Mud which constitutes the bed of a lake.
ENVO:00005798	acid dune sand	ENVO:01000017	sand			
ENVO:00005799	rocky sand	ENVO:01000017	sand			
ENVO:00005800	desert sand	ENVO:01000017	sand			Sand which is part of a desert.
ENVO:00005802	bulk soil	ENVO:00001998	soil			Soil that is not penetrated by the root systems of plants.
ENVO:00010483	environmental material			portion of environmental material		A portion of environmental material is a fiat object part which forms the medium or part of the medium of an environmental system.
ENVO:00010505	aerosol	ENVO:00010483	environmental material		envoAtmo	Airborne solid particles (also called dust or particulate matter (PM)) or liquid droplets.
ENVO:00010506	emulsion	ENVO:00010483	environmental material			A mixture of two immiscible (unblendable) substances. One substance (the dispersed phase) is dispersed in the other (the continuous phase).
ENVO:00010623	dolomite	ENVO:00002016	sedimentary rock			A sedimentary carbonate rock and a mineral, both composed of calcium magnesium carbonate CaMg(CO3)2 found in crystals.
ENVO:0010001	anthropogenic environmental material	ENVO:00010483	environmental material			Anthropogenic material in or on which organisms may live.
ENVO:0010003	agricultural environmental material	ENVO:0010001	anthropogenic environmental material			
ENVO:01000000	humus	ENVO:01000814|ENVO:04000008	soil organic matter|solid environmental material			Organic matter in soil which has reached a point of stability, where it will break down no further and might, if conditions do not change, remain essentially as it is for centuries, or millennia.
ENVO:01000001	mud	ENVO:00010483	environmental material			A liquid or semi-liquid mixture of water and some combination of soil, silt, and clay.
ENVO:01000016	silt	ENVO:00010483	environmental material			Silt is granular material of a size somewhere between sand and clay whose mineral origin is quartz and feldspar.
ENVO:01000017	sand	ENVO:00010483	environmental material			A naturally occurring granular material composed of finely divided rock and mineral particles.
ENVO:01000018	gravel	ENVO:00010483	environmental material			Gravel is an environmental material which is composed of pieces of rock that are at least two millimeters (2mm) in its largest dimension and no more than 75 millimeters.
ENVO:01000060	particulate matter	ENVO:00010483	environmental material		envoAtmo|envoPolar	Particulate material is an environmental material which is composed of microscopic portions of solid or liquid material suspended in another environmental material.
ENVO:01000063	planktonic material	ENVO:01000155	organic material		envoPolar	A portion of planktonic material is a portion of environmental material primarily composed of plankton.
ENVO:01000070	terrigenous sediment	ENVO:00002007	sediment			Sediment comprised of weathered continental rocks, wind blown dust, volcanic ash or other terrestrial material.
ENVO:01000082	biogenous sediment	ENVO:00002007	sediment		envoPolar	Biogenous sediment is derived from living organisms, typically planktonic organisms possessing shells, frustules or coccoliths.
ENVO:01000110	hydrogenous sediment	ENVO:00002007	sediment			Hydrogenous sediment is derived from solutes that precipitate out of sea water by a variety of chemical reactions. These are typically less abundant than other sediment types.
ENVO:01000111	cosmogenous sediment	ENVO:00002007	sediment			Cosmogenous sediment is derived from extraterrestrial dust and debris in the form of meteorites and similar entities.
ENVO:01000112	polymetallic nodule	ENVO:01000110	hydrogenous sediment	manganese nodule		Polymetallic nodules, also called manganese nodules, are rock concretions on the sea bottom formed of concentric layers of iron and manganese hydroxides around a core. Nodules vary in size from tiny particles visible only under a microscope to large pellets more than 20 centimetres (8 in) across. However, most nodules are between 5 and 10 cm in diameter.
ENVO:01000113	suspended sediment	ENVO:00002007	sediment			Suspended sediment, or suspended load, is the term for the particles settle  slowly enough to be carried in flowing water (such as a stream or coastal area) either without touching the bed or while only intermittently touching it. These particles are generally of the fine sand, silt and clay size, although larger particles may be carried as well depending on the intensity of the flow.
ENVO:01000114	boulder sediment	ENVO:00002007	sediment			Sediment characterised by an average particle diameter greater than 256 mm.
ENVO:01000115	cobble sediment	ENVO:00002007	sediment			Sediment characterised by an average particle diameter between 64 and 256 mm.
ENVO:01000116	pebble sediment	ENVO:00002007	sediment			Sediment characterised by an average particle diameter between 4 and 32 mm.
ENVO:01000117	granular sediment	ENVO:00002007	sediment			Sediment characterised by an average particle diameter between 2 and 4 mm.
ENVO:01000118	sandy sediment	ENVO:00002007	sediment			Sediment characterised by an average particle diameter between 62.5 micrometers and 2 mm.
ENVO:01000119	silty sediment	ENVO:00002007	sediment			Sediment characterised by an average particle diameter between 3.9 and 62.5 micrometers.
ENVO:01000120	clay sediment	ENVO:00002007	sediment			Sediment characterised by an average particle diameter between 1 and 3.9 micrometers.
ENVO:01000121	colloidal sediment	ENVO:00002007	sediment			Sediment characterised by an average particle diameter below 1 micrometer.
ENVO:01000131	mesophilic sediment	ENVO:00002007	sediment			Sediment characterised by a temperature of 15-45 degrees Celsius and high-to-low oxygenation. Often impacted by hydrothermal fluid flows.
ENVO:01000132	thermophilic sediment	ENVO:00002007	sediment			Sediment characterised by a temperature of 45-75 degrees Celsius and low to no oxygen content. Often impacted by hydrothermal fluid flows.
ENVO:01000133	hyperthermophilic sediment	ENVO:00002007	sediment			Sediment characterised by a temperature of 80-125 degrees Celsius and no oxygen content. Often impacted by hydrothermal fluid flows.
ENVO:01000134	hydrothermal fluid	ENVO:00002141	leachate			High temperature water ejected from hydrothermal vents and laden with dissolved metals and minerals as a result of percolation through crustal rocks.
ENVO:01000135	nitrate-reducing sediment	ENVO:00002045	anaerobic sediment		envoPolar	Sediment hosting and characterised by active nitrate reducing microbial communities.
ENVO:01000151	manganese-reducing sediment	ENVO:00002045	anaerobic sediment		envoPolar	Sediment hosting and characterised by active manganese reducing microbial communities.
ENVO:01000152	iron-reducing sediment	ENVO:00002045	anaerobic sediment		envoPolar	Sediment hosting and characterised by active iron reducing microbial communities.
ENVO:01000153	sulphate-reducing sediment	ENVO:00002045	anaerobic sediment		envoPolar	Sediment hosting and characterised by active sulphate reducing microbial communities.
ENVO:01000154	carbon dioxide-reducing sediment	ENVO:00002045	anaerobic sediment		envoPolar	Sediment hosting and characterised by active carbon dioxide reducing microbial communities.
ENVO:01000155	organic material	ENVO:00010483	environmental material	biomass		Environmental material derived from living organisms and composed primarily of one or more biomacromolecules.
ENVO:01000156	biofilm material	ENVO:01000155	organic material			Material derived from a biofilm, an aggregate of microorganisms in which cells adhere to each other and/or to a surface. These adherent cells are frequently embedded within a self-produced matrix of extracellular polymeric substance (EPS). Biofilm EPS, which is also referred to as slime, is a polymeric conglomeration generally composed of extracellular DNA, proteins, and polysaccharides in various configurations.
ENVO:01000157	microbial mat material	ENVO:01000155	organic material		envoPolar	Material derived from a microbial mat, a multi-layered sheet of micro-organisms, mainly bacteria and archaea. Microbial mats create a wide range of internal chemical environments.
ENVO:01000158	marine snow	ENVO:01001103	detritus		envoPolar	Marine snow is a continuous shower of mostly organic detritus falling from the upper layers of the water column. Its origin lies in activities within the productive photic zone.
ENVO:01000173	anoxic water	ENVO:00002006	liquid water	anaerobic water|reducing water		Water which lacks dissolved oxygen.
ENVO:01000231	lava	ENVO:00010483	environmental material			Lava is a mixture of molten or semi-molten rock, volatiles, and solids which has extruded beyond a planetary crust.
ENVO:01000232	felsic lava	ENVO:01000231	lava	silicic lava		Felsic lava is lava which is high in silica (> 69 percent by weight), aluminium, potassium, sodium, and calcium, forming a polymerized liquid rich in feldspar and quartz. Felsic lava has a  higher viscosity than other magma types. Felsic magmas can erupt at temperatures as low as 650 to 750 °C. Unusually hot (>950 °C) rhyolite lavas, however, may flow for distances of many tens of kilometres
ENVO:01000233	intermediate lava	ENVO:01000231	lava	andesitic lava		Intermediate lava is lava which, relative to felsic lava, is lower in aluminium and silica (between 52 and 63 percent by weight), and usually somewhat richer in magnesium and iron. The temperature of intermediate lava ranges from 750 to 950 degrees Celsius, destroying polymerized bonds and promoting more fluid behaviour relative to felsic lavas and also a greater tendency to form phenocrysts. Higher iron and magnesium tends to manifest as a darker groundmass, and also occasionally amphibole or pyroxene phenocrysts.
ENVO:01000234	mafic lava	ENVO:01000231	lava	basaltic lava		Mafic lava is lava which, relative to other lava types other than ultramafic lava, has a  high ferromagnesian content and low aluminium and silica content, with silca making up between 45 and 52 percent of its weight. Mafic lava generally erupts at temperatures in excess of 950 degrees Celsius. The high temperature and low polymerisation in mafic lava favors low viscosity and chemical diffusion, promoting the formation of large, well-formed phenocrysts.
ENVO:01000235	ultramafic lava	ENVO:01000231	lava			Ultramafic lava is lava which, relative to other lava types, has very high magnesium oxide content and less than 45 percent silica by weight is thought to have erupted at temperatures of 1600 degrees Celsius. Due to its high temperature and composition, the viscosity of ultramafic lava is very low.
ENVO:01000236	basalt	ENVO:00002013	igneous rock			Basalt is a volcanic rock which is formed by the rapid cooling of basaltic lava.
ENVO:01000256	mineral material	ENVO:01000814	solid environmental material			A mineral material is an environmental material which is primarily composed of some substance that is naturally occurring, solid and stable at room temperature, representable by a chemical formula, usually abiogenic, and that has an ordered atomic structure.
ENVO:01000266	water vapour	ENVO:01000797	gaseous environmental material	aqueous vapor|aqueous vapour|water vapor		Water vapour is a vapour which is the gas phase of water.
ENVO:01000268	atmospheric water vapour	ENVO:01000266	water vapour	atmospheric water vapor	envoPolar	Atmospheric water vapour is water vapour that is part of an atmosphere.
ENVO:01000269	siltstone	ENVO:01000271	clastic sedimentary rock			A sedimentary rock which is composed mainly of silt. This rock has a grainsize in the silt range, finer than sandstone and coarser than claystones.
ENVO:01000270	claystone	ENVO:01000271	clastic sedimentary rock			A clastic sedimentary rock which is composed primarily of clay sized particles.
ENVO:01000271	clastic sedimentary rock	ENVO:00002016	sedimentary rock			Clastic sedimentary rocks are sedimentary rocks that are composed of silicate minerals and rock fragments that were transported by moving fluids. Clastic rocks are composed largely of quartz, feldspar, rock (lithic) fragments, clay minerals, and mica; numerous other minerals may be present as accessories and may be important locally.
ENVO:01000272	mudstone	ENVO:01000271	clastic sedimentary rock			A mudstone is a clastic sedimentary rock which contains a mixture of at least one third of silt- and one third of clay-sized particles.
ENVO:01000273	lime mudstone	ENVO:00002053	limestone	calcilutite|cementstone		Lime mudstone is a limestone which is primarily composed of either clay-size or both silt-size and clay-size detrital (transported) carbonate grains.
ENVO:01000274	slate	ENVO:00002017	metamorphic rock			Slate is a metamorphic rock which is fine-grained, foliated, homogeneous, Slates are derived from clastic sedimentary rocks.
ENVO:01000277	water ice	ENVO:01000814|ENVO:01001125	ice|solid environmental material	ice	envoPolar	Ice is water frozen into a solid state. It can appear transparent or opaque bluish-white color, depending on the presence of impurities or air inclusions. The addition of other materials such as soil may further alter its appearance.
ENVO:01000301	estuarine water	ENVO:00002019	brackish water			Brackish water which is part of an estuary.
ENVO:01000349	root matter	ENVO:01000155	organic material			An organic material primarily composed of a portion of plant root.
ENVO:01000350	autoclaved sand	ENVO:01000017	sand			Autoclaved sand is sand that has been sterlised by exposure to high pressure saturated steam at at least 121 degrees Celsius.
ENVO:01000356	granite	ENVO:00002013	igneous rock			A portion of granite is a portion of igneous  rock which  is intrusive, felsic, granular, and phaneritic.
ENVO:01000357	alkaline water	ENVO:00002006	liquid water			A portion of alkaline water is a portion of water with a pH greater than 7.
ENVO:01000358	acidic water	ENVO:00002006	liquid water			A portion of acidic water is a portion of water with a pH less than 7.
